125620851,1,2,3,26,1,1,1,8,I am satisfied with fast processing speed when using the mobile phone. Rear cameras take beautiful and clear photos. No complaints.,10,I like the nice and modern appearance design with rectangular shape. ,,,,,,,,,,,,,,,,,,,,,,,,,It was damaged,6,,,,,,6,,,,,,,,,,,,,,,,,,,,,1,2,,,,,,,,,,,,,,,,,,,,,,,,,,,,,,,,,,,,,99,,,,,,,,,,,,,,,,,,,,,,,,,,,,,,,,,,,,,,,,,,,,,,,,,,,,,,,,,,,,,,,,,,,,,,,,,,,,,,,,,,,,,,,,,,,,,,,,,,,,,,,,,,,,,,,,,,99,9,,1,,2,,4,6,,,,,,,,,,,,9,,,,99,,,,,,,,,,,,,,,,,,,,,,,,,,,,99,4,,99,99,99,1,
125620923,1,1,5,36,1,1,1,7,"The device is unstable when playing games, the dynamic graphics on games runs not smoothly and if playing games for a long time, the cellphone heats up.",6,"The smartphone heats up fast and unstable if using it heavily purposes and, then, it hangs or lags.",,,,,,,,,,,,,,,,16,,,,,,,,,,99,,,,,,,,,,,,,,,15,,,,,,,,,,,,,,,,5,6,,,,,,,,,,,,,,,,22,,,,,,,,,,,,,,,,,99,,,,,,,,,,,,,,,,,,,,,,,,,,,,,,,,,,,,,,,,,,,,,,,,,,,,,,,,,,,,,,,,,,,,,,,,,,,,,,,,,,,,,,,,,,,,,,,,,,,,,,4,,,7,,,,,,,,,,9,,1,,2,,5,6,,,,,,,,,,,,5,,,,99,,,,,,,,,,,,12,13,14,,,,,,,,,,,,,,,10,,3,1,99,2,67
125620938,1,2,5,36,1,1,1,8,I am satisfied with fast processing speed when using the smartphone. No complaints.,8,I like this model is easy to use or navigate and smooth and good flow when accessing through apps.,,,,,,,,,,,,,,,,,,,,,,22,,,,6,,,,,,6,,,,,,,,,,,,,,,,,,,,,1,2,,,,,,,,,,,,,,,,,,,,,,,,,,,,,,,,,,,,,99,,,,,,,,,,,,,,,,,,,,,,,,,,,,,,,,,,,,,,,,,,,,,,,,,,,,,,,,,,,,,,,,,,,,,,,,,,,,,,,,,,,,,,,,,,,,,,,,,,,,,,,,,,,,,,,,,,99,9,,1,,2,,3,1,,98,iPhone 12,,,,,,,,,,,,,14,,,,,,,,,,,,,,,,,,,,,,,,,,,Faster processing speed and faster updating data ,,6,,99,99,99,2,6
125620970,1,2,5,37,1,1,1,10,"I am satisfied with fast processing speed, smooth and good flow when using the device.",9,I like front camera takes beautiful and clear photos and this model has a nice and modern appearance design.,1,2,,,,,,,,,,,,,,,,,,,,,,,,6,,,,,,,,,,,,,13,,,,,,,,,,,,,,,,,,,6,7,,,,,,,14,15,,,,,,,,,,,,,,,,,,,,,,,,99,,,,,,,,,,,,,,,,,,,,,,,,,,,,,,,,,,,,,,,,,,,,,,,,,,,,,,,,,,,,,,,,,,,,,,,,,,,,,,,,,,,,,,,,,,,,,,,,,,,,,,,,,,,,,,,,,,99,9,,1,,2,,6,3,,,,,,98,A3s,,,,,,,,,2,,,,,,,,,,,,,,,,,,,,,,,,,,,,99,4,,3,99,99,2,21
125621000,1,1,5,35,1,1,1,10,I am satisfied with overall good usage experience and easy to use device and fast processing speed.,10,Fast charging speed and long-used battery.,,,,,,,,,,,,,13,,,,,,,,,22,,,,99,,,,,,,,,,,,,13,,,,,,,,,,,,,,,,,,5,6,7,,,,,,,,,,,,,,,,,,,,,,,,,,,,,,,,99,,,,,,,,,,,,,,,,,,,,,,,,,,,,,,,,,,,,,,,,,,,,,,,,,,,,,,,,,,,,,,,,,,,,,,,,,,,,,,,,,,,,,,,,,,,,,,,,,,,,,,,,,,,,,,,,,,99,5,,1,,2,,5,6,,,,,,,,,,,,5,,,,99,,,,,,,,,,,,,,,,,,,,,,,,,,,,99,2,,99,99,99,2,53
125621057,1,1,4,30,1,1,1,9,Fast processing speed with no hangs or lags when using multiple apps at the same time. And speedy responses  when using the device.,9,Big ROM capacity and fast charging speed. Smooth and good flow when using the device.,1,2,,,,,,,,,,,,,,,,,,,,,,,,7,,,,,,,,,,,,,,,15,,,,,,,,,,,,,,,,,,7,,,,,,,,,,,,,20,21,22,,,,,3,,5,,,,,,,,,,,,,,,,,,,,,,,,,,,,,,,,,1,,,,,,,,,,,,,,,,,,,,,,,,,7,,,,,,,,,,,,,,,,,,,,,,,,4,,,,,9,,,,,,,,,,,,,,,,,,,,,,,,,,,,,,,,,,,,,99,7,,4,,2,,5,5,,,,,,,,,,7,,,,,,9,,,,,,,,,,,,,,,,,,,,,,,,,,,,99,10,,4,2,99,2,36
125621295,1,2,5,35,1,1,1,9,Has a nice appearance and slim and thin body shape design. Smooth and responsive touchscreen. Front camera take beautiful selfie photos.,9,Front and rear cameras take clear and sharp photos. Big memory size. Has a nice appearance and design.,,,,,,,,,,,,,13,,,,,,,,,,,,,99,,,,,,,,,,,,12,,,,,,,,,,,,,,,1,,,4,,,,,,,,,,,,,,,,,,,,,,,,,,,,,,,,,,,99,,,,,,,,,,,,,,,,,,,,,,,,,,,,,,,,,,,,,,,,,,,,,,,,,,,,,,,,,,,,,,,,,,,,,,,,,,,,,,,,,,,,,,,,,,,,,,,,,,,,,,,,,,,,,,,,,,99,9,,1,,2,,4,3,,,,,,5,,,,,,,,,,4,,,,,,,,,,,,,,,,,,,,,,,,,,,,99,3,,3,3,99,2,9
125621338,1,2,3,25,1,1,1,8,I am satisfied with smooth and good flow when using the device. Rear cameras take clear and sharp photos even when using night mode.,10,I like the overall nice and modern appearance design from this model.,,,,,,,,,,,,,,,,,,,,,,,,,It was damaged,99,,,,,,6,,,,,,,,,,,,,,,,,,,,,,,,,,6,7,,,,,,,,,,,,,,,,,,,,,,,,,,,,,,,,99,,,,,,,,,,,,,,,,,,,,,,,,,,,,,,,,,,,,,,,,,,,,,,,,,,,,,,,,,,,,,,,,,,,,,,,,,,,,,,,,,,,,,,,,,,,,,,,,,,,,,,,,,,,,,,,,14,,,5,,1,,2,,3,5,,,,,,,,,,98,Y20,,,,,4,,,,,,,,,,,,,,,,,17,18,,,,,,,,,,,3,,3,99,99,2,28
125621523,1,1,3,26,1,1,1,8,"Smooth and good flow when playing games, no hangs or lags. And the cameras are able to adjust the clarity or sharpness of the photos.",9,Big RAM and ROM capacity. High definition screen display. Smooth and good flow when using this device.,,,,4,,,,8,,,,,,,,,,,,,,,,,,6,,,,,,,,,,,,,,,15,,,,,,,,,,,,,,,,5,6,7,,,,,,,,,,,,,20,21,,,,,,,,,,,,,,,,,,99,,,,,,,,,,,,,,,,,,,,,,,,,,,,,,,,,,,,,,,,,,,,,,,,,,,,,,,,,,,,,,,,,,,,,,,,,,,,,,,,,,,,,,,,,,,,,,,,,,,,,,,,,,,,,,,,,,99,7,,4,,2,,5,4,,,,,,,,4,,,,,,,,99,,,,,,,,,,,,12,,14,15,,,,,,,22,,,,,,,10,,3,2,99,2,22
125621732,1,2,5,37,1,1,1,8,Front and rear cameras take beautiful both static photos as well as videos. This model has a nice body color.,8,"Overall the performance is good, smooth and good flow when using the device. Has a nice appearance design. Not expensive price.",,,,,,,,,,,,,13,,,,,,,,,,,,,7,,,,,,,,,,,,12,,,,,,,,,,,,,,,1,,,,,6,7,,,,,,,14,15,,,,,,,,,,,,,,,,,,,,,,,,99,,,,,,,,,,,,,,,,,,,,,,,,,,,,,,,,,,,,,,,,,,,,,,,,,,,,,,,,,,,,,,,,,,,,,,,,,,,,,,,,,,,,,,,,,,,,,,,,,,,,,,,,,,,,,,,,,,99,2,,1,,2,,4,3,,,,,,5,,,,,,,,,,3,,,,,,,,,,,,12,13,14,15,16,17,,,,,,,,,,,,9,,3,2,99,2,14
125627067,1,1,4,34,1,1,1,9,"Overall the performance of this model is good. When connecting to other devices like Bluetooth earbuds, the sound system is clear and loud.",9,This model has a nice appearance and body design. Front and rear cameras take clear and sharp photos. Big RAM and ROM capacity.,,,,,,,,,,10,,,,,,,,,,,,,,,,99,,,,,,,,,,,,12,,,,,,,,,,,,,,,,,,,,6,7,,,,,12,,,,,,,,,,22,,,,,,,,,,,,,,,,,99,,,,,,,,,,,,,,,,,,,,,,,,,,,,,,,,,,,,,,,,,,,,,,,,,,,,,,,,,,,,,,,,,,,,,,,,,,,,,,,,,,,,,,,,,,,,,,,,,,,,,,,,,,,,,,,,,,99,9,,1,,2,,4,2,,,,6,,,,,,,,,,,,99,,,,,,,,,,,,,,,,,,,,,,,,,,,,99,3,,5,3,99,2,18
125627104,1,1,2,23,1,1,1,8,Fast charging battery and has a nice appearance and body design. Fast processing speed when accessing through apps without hangs or lags.,8,Good specifications like big RAM and ROM capacity as well as large battery capacity with dual speakers. But it is pretty high price.,,,,,,,,,,,,,,,,16,,,,,,,,,,3,,,,,,,,,,,,,,,15,,,,,,,,,,,,,,,,5,6,7,8,9,,,12,,14,15,,,,,20,21,,,,,,,,5,,,,,,,,,,,,,,,,,,,,,,,,,,,,,,,,,,,,,,,,,,,,,,,,,,,,,2,,,,,,,,,,,,,,,,,,,,,,,,,,,2,,4,,,,,,,,,,,,,,,,,,,,,,,,,,,,,,4,,,,,,,,,,,,,3,,1,,2,,5,5,,,,,,,,,,10,,,,,,3,,,,,,,,,,,11,12,13,14,15,,,,,,,,,,,,,,10,,3,2,99,2,17
125627127,1,2,3,27,1,1,1,10,Rear cameras take beautiful clear and sharp photos with wide-angle lens can capture all subjects details.   ,10,Rear cameras take beautiful clear and sharp photos with wide-angle lens can capture all subjects details. Has a nice appearance design and rear cover made of leather makes it look nice. ,,,,,,,,,,,,,,,,,,,,,,,,,It was damaged,2,,,,,,,,,,,,,13,,,,,,,,,,,,,,1,,,4,,,,,,,,,,14,,,,,,,,,,,,,3,,,,,,,,,,,,,,,,,,,,,,,,,,,,,,,,,,,,,,,,,,,99,,,,,,,,,,,,,,,,,,,,,,,,,,,,,,,,,,,,,,1,,,,,,,,,,,,,,,,,,,,,5,,,,,,,,,,,,,,,,,,,,,,14,,,2,,3,,2,,6,7,,,,,,,,,,,,,,6,,2,,,,,,,,,,,,,,,,,,,,,,,,,,,,99,3,,4,1,2,2,21
125627353,1,2,7,45,1,1,1,9,Easy and not complicated system to use. Has a nice appearance and slim and thin body shape design makes it a compact size.,10,Easy and not complicated system to use. Has a nice appearance and slim and thin body shape design makes it a compact size. Wide screen display size as well.,,2,,,,,,,,,,,,,,,,,,,,,,,,2,,,,,,,,,,,,12,,,,,,,,,,,,,,,1,,,4,,,7,,,,11,,,,,,,,,,,,,,,,,,,,,,,,,,,,99,,,,,,,,,,,,,,,,,,,,,,,,,,,,,,,,,,,,,,,,,,,,,,,,,,,,,,,,,,,,,,,,,,,,,,,,,,,,,,,,,,,,,,,,,,,,,,,,,,,,,,,,,,,,,,,,,,99,3,,3,,2,,6,3,,,,,,99,,,,,,,,,,3,,,,,,,,,,,,,,,,,,,,,,,,,,,Should have the energy guage available inside the device,,9,,5,2,3,2,30
125627420,1,2,5,35,1,1,1,9,"Rear cameras take beautiful, high resolution and clear photos. Fast processing and speedy responses.",10,"Rear cameras take beautiful, high resolution and clear photos. Fast processing and speedy responses. Has a proper body size with wide screen display.",,,,,,,,,,,,,,,,,,,,,,,,,It was damaged,3,,,,,,,,,,,,12,,,,,,,,,,,,,,,1,,,,,6,,,,,11,,,14,,,,,,,,,,,,,,,,,,,,,,,,,99,,,,,,,,,,,,,,,,,,,,,,,,,,,,,,,,,,,,,,,,,,,,,,,,,,,,,,,,,,,,,,,,,,,,,,,,,,,,,,,,,,,,,,,,,,,,,,,,,,,,,,,,,,,,,,,,,,99,2,,3,,1,3,5,5,,,,,,,,,,9,,,,,,7,,,,,,,,,,,,,,,,,,,,,,,,,,,,99,9,,4,3,99,2,51
125627547,1,2,4,31,1,1,1,10,"Front and rear cameras take beautiful, clear and high resolution with vivid-colored photos.",10,"Front and rear cameras take beautiful, clear and high resolution with vivid-colored photos. Fast charging speed and long-used battery.",,,,,,,,,,10,,,,,,,,,,,,,,,,7,,,,,,,,,,,,,13,,,,,,,,,,,,,,,,,,,,,,,,,,,14,15,,,,,20,21,,,,,,,,,,,,,,,,,,99,,,,,,,,,,,,,,,,,,,,,,,,,,,,,,,,,,,,,,,,,,,,,,,,,,,,,,,,,,,,,,,,,,,,,,,,,,,,,,,,,,,,,,,,,,,,,,,,,,,,,,,,,,,,,,,,,,99,5,,1,,2,,5,3,,,,,,5,,,,,,,,,,6,,,,,,,,,,,,,,,,,,,,,,,,,,,,99,9,,3,3,5,2,6
125627618,1,2,9,59,1,1,1,8,There is not problem found when calls.,9,There is not problem found when calls with clear and loud sound while having telophone conversation. Front and rear cameras take beautiful and clear photos.,,,,,,,,,,,,,,,,,,,,,,,,,It was damaged,5,,,,,,,,,,,,12,,,,,,,,,,,,,,,1,2,,,,,,,,,,,,14,15,,,,,,,,,,,,,,,,,,,,,,,,99,,,,,,,,,,,,,,,,,,,,,,,,,,,,,,,,,,,,,,,,,,,,,,,,,,,,,,,,,,,,,,,,,,,,,,,,,,,,,,,,,,,,,,,,,,,,,,,,,,,,,,,,,,,,,,,,,,99,7,,1,,2,,6,2,,,,99,,,,,,,,,,,,99,,,,,,,,,,,,,,,,,,,,,,,,,,,,99,2,,5,6,5,2,55
125627683,1,2,6,44,1,1,1,8,Rear cameras take beautiful and clear photos. Has a nice appearance and body design which suits the grip.,10,Rear cameras take beautiful and clear photos. Has a nice appearance and body design which suits the grip. Wide screen display and smooth and responsive touchscreen.,,,,,,,,,,,,,,,,16,,,,,,,,,,5,,,,,,,,,,,,,,,,,,,,,21,,,,,,1,,,,,,,,,,11,,,14,15,,,,,,,,,,,,,,,,,,,,,,,,99,,,,,,,,,,,,,,,,,,,,,,,,,,,,,,,,,,,,,,,,,,,,,,,,,,,,,,,,,,,,,,,,,,,,,,,,,,,,,,,,,,,,,,,,,,,,,,,,,,,,,,,,,,,,,,,,,,99,7,,3,,2,,5,3,,,,,,99,,,,,,,,,,2,,,,,,,,,,,,,,,,,,,,,,,,,,,,99,98,General labour,2,1,2,2,31
125627712,1,2,6,43,1,2,1,10,Fast processing speed when using the device and high definition screen display.,10,Fast processing speed when using the device and high definition screen display. Fast charging speed and long-used battery.,1,,,,,,,,,,,,,,,,,,,,,,,,,2,,,,,,,,,,,,12,,,,,,,,,,,,,,,,,,,,6,,8,,10,,,,,,,,,,20,21,,,,,,,,,,,,,,,,,,99,,,,,,,,,,,,,,,,,,,,,,,,,,,,,,,,,,,,,,,,,,,,,,,,,,,,,,,,,,,,,,,,,,,,,,,,,,,,,,,,,,,,,,,,,,,,,,,,,,,,,,,,,,,,,,,,,,99,7,,4,,2,,3,3,,,,,,99,,,,,,,,,,4,,,,,,,,,,,,,,,,,,,,,,,,,,,,99,3,,99,99,99,1,
125627749,1,1,8,50,1,1,1,8,Big memory size and fast processing speed when using the smartphone.,9,Big memory size and fast processing speed when using the smartphone. Wide screen display with big font size.,,,,,,,,,,,,,,,,,,,,,,,,,It was damaged,2,,,,,,,,,,,,12,,,,,,,,,,,,,,,1,,,,,6,7,,,,11,,,,,,,,,,,,,,,2,,,,,,,,,,,,,,,,,,,,,,,,,,,,,,,,,,,99,,,,,,,,,,,,,,,,,,,,,,,,,,,,,,,,,,,,,,,,,,,,,,,,,,,,,,,9,,,,,,,,,,,,,,,,,,,,,,,,,,,6,,,,,,,,14,,,5,,1,,2,,6,2,,,,98,J7,,,,,,,,,,,5,,,,,,,,,,,,,,,,,,,,,,,,,,,,99,98,General labour,2,1,2,2,8
125628027,1,1,4,30,1,1,1,8,Overall good usage experiences. Fast processing speed when using it. There is no problem found but only heating issue.,8,Has slim and thin body shape design which suits the grip. Speedy responses when using the device. Durable battery which lasts for a long time.,,,,,,,,,,,,,13,,,,,,,,,,,,,99,,,,,,,,,,,,12,,,15,,,,,,,,,,,,1,,,,5,6,7,,,,,,,,,,,,,,,22,,,,,,,5,,,,,,,,,,,,,,,,,,,,,,,,,,,,,,,,,,,,,,,,,,,,,,,,,,,,1,,,,,,,,,,,,,,,,,,,,,,,,,,,,,,,,,,,,,,,,14,,,,,,,,,,,,,,,,,,,,,,,,,,,,,,,,99,7,,4,,2,,4,4,,,,,,,,8,,,,,,,,7,,,,,,,,,,,,12,,14,15,,,,,,,,,,,,,,3,,3,3,99,1,
125628062,1,2,5,37,1,1,1,10,Fast processing speed. Smooth and good flow and big memory size offered by this model.,9,Fast processing speed. Smooth and good flow and big memory size. Rear cameras take beautiful and sharp photos.,,,,,,,,,,,,,,,,,,,,,,,,,It was damaged,4,,,,,,,,,,,11,,,,,,,,,,,,,,,,,,,,,6,7,,,,,,,14,,,,,,,,,,,,2,,,,,,,,,,,,,,,,,,,,,,,,,,,,,,,,,,,99,,,,,,,,,,,,,,,,,,,,,,,,,,,,,,,,,,,,,,,,,,,,,,,,,,,,,,,,,,,,,,,99,,,,,,,,,,,,,,,,,,,6,,,,,,,,14,,,7,,4,,2,,6,2,,,,98,A10,,,,,,,,,,,99,,,,,,,,,,,,,,,,,,,,,,,,,,,,99,10,,2,99,99,2,55
125628109,1,1,2,22,1,1,1,10,The smartphone has a big memory size. Front and rear cameras take beautiful and sharp photos.,10,The smartphone has a big memory size. Front and rear cameras take beautiful and sharp photos. There is no hangs or lags when playing games.,,,,,,,,,,,,,,,,,,,,,,,,,It was damaged,6,,,,,,,,,,,,,13,,,,,,,,,,,,,,1,,,,,6,,,,,,,,14,15,,,,,,,,,,,,,,,,,,,,,,,,99,,,,,,,,,,,,,,,,,,,,,,,,,,,,,,,,,,,,,,,,,,,,,,,,,,,,,,,,,,,,,,,,,,,,,,,,,,,,,,,,,,,,,,,,,,,,,,,,,,,,,,,,,,,,,,,,,,99,2,,98,Pay installment with the store,2,,5,3,,,,,,99,,,,,,,,,,3,,,,,,,,,,,,,,,,,,,,,,,,,,,,99,98,General labour,2,1,2,2,55
125628127,1,1,4,32,1,1,1,9,Smooth and good flow when playing games. There is a good surround sound system from speakers. Big memory size makes it is able to upload and store much data.,8,The specifications matches with the price. What missing from this model is just only 5G. The rest is very good performances.,,,,,,,,,,10,,,,,,,,,,,,,,,,7,,,,,,,,,,,,,,,,16,,,,,,,,,25,,,,,,,6,7,,,,,,,,,,,,,,,,,,,,,,,,,,,,,,,,99,,,,,,,,,,,,,,,,,,,,,,,,,,,,,,,,,,,,,,,,,,,,,,,,,,,,,,,,,,,,,,,,,,,,,,,,,,,,,,,,,,,,,,,,,,,,,,,,,,,,,,4,,,,,,,,,,,,,3,,1,,2,,5,7,,,,,,,,,,,,,,5,,5,,,,,,,,,,,,12,,14,15,,,,,,,,,,,,,,10,,3,2,99,2,60
125628156,1,1,6,43,1,1,1,8,"Fast and responsive touchscreen, no hangs or lags. Fast charging speed with long-used battery.",8,"Fast and responsive touchscreen, no hangs or lags. Fast charging speed with long-used battery. Has a nice appearance and body design. Front and rear cameras take clear and sharp photos.",,,,,,,,,,,,,13,,,,,,,,,,,,,6,,,,,,,,,,,,12,,,,,,,,,,,,,,,1,,,,,6,7,,,,,,,14,15,,,,,20,21,,,,,,,,5,,,,,,,,,,,,,,,,,,,,,,,,,,,,,,,,,,,,,,,,,,,,,,,,,,,,,,,,,,,,,,99,,,,,,,,,,,,,,,,,1,,,,,,,,,,,,,,,,,,,,4,5,,,,,,,,,,,,,,,,,,,,,,14,,,9,,1,,2,,5,5,,,,,,,,,,9,,,,,,99,,,,,,,,,,,,,,,,,,,,,,,,,,,,99,98,General labour,3,2,5,2,29
125628218,1,1,9,55,1,1,1,8,Easy to use device. Smooth and responsive touchscreen and wide screen display size.,10,Easy to use device. Smooth and responsive touchscreen and wide screen display size. Fast charging speed and long-used battery.,,,,,,,,,,10,,,,,,,,,,,,,,,,99,,,,,,,,,,,11,,,,,,,,,,,,,,,,1,,,,,,,,,,11,,,,,,,,,20,21,,,,,,,,,,,,,,,,,,99,,,,,,,,,,,,,,,,,,,,,,,,,,,,,,,,,,,,,,,,,,,,,,,,,,,,,,,,,,,,,,,,,,,,,,,,,,,,,,,,,,,,,,,,,,,,,,,,,,,,,,,,,,,,,,,,,,99,5,,3,,2,,6,3,,,,,,99,,,,,,,,,,99,,,,,,,,,,,,,,,,,,,,,,,,,,,,99,98,General labour,2,2,99,2,19
125628257,1,1,5,37,1,1,1,8,Big memory size and durable battery with fast charging speed. Smooth and good flow when using the device.,9,"Fast  processing speed, speedy responses without hangs or lags. Easy to use system.",,,,,,,,,,,,,,,,,,,,,,,,,It was damaged,99,,,,,,,,,,,,,,,15,,,,,,,,,,,,,,,,5,6,7,8,,,11,,,,,,,,,20,21,,,,,2,3,,5,,7,,,,,,,,,,,,,,,,,,,,,,,,,,,,,,99,,,,,,,,,99,,,,,,,,,,,,,,,,,,,,,99,,,,,,,,,1,,,,,,,,,,,4,,,,,,,,,,,,,,,,,,,,,,,,,,,,,,,,,,,,,,,,,,99,9,,1,,2,,5,3,,,,,,7,,,,,,,,,,99,,,,,,,,,,,,,,14,15,,,,,,,22,23,,,,,,10,,3,2,99,2,3
125628349,1,2,6,40,1,1,1,10,Has a nice appearance and body design with beautiful body color. Front and rear cameras take beautiful and clear photos.,10,Easy to use device with a stable system without hangs or lags. Smooth and responsive touchscreen.,,,,,,,,,,,,,,,,16,,,,,,,,,,7,,,,,,,,,,,,12,,,,,,,,,,,,,,,1,2,3,4,,,,,,,,,,14,15,,17,18,,,,,,,,,,,,,,,,,,,,,99,,,,,,,,,,,,,,,,,,,,,,,,,,,,,,,,,,,,,,,,,,,,,,,,,,,,,,,,,,,,,,,,,,,,,,,,,,,,,,,,,,,,,,,,,,,,,,,,,,,,,,,,,,,,,,,,,,99,2,,1,,2,,4,3,,,,,,5,,,,,,,,,,4,,,,,,,,,,,,,,,,,,,,,,,,,,,,99,9,,3,99,99,2,25
125628443,1,2,7,49,1,2,1,9,Both cameras take beautiful photos and the body size of this model is just-right.,9,Overall good performance without hangs or lags. Long-used battery which lasts for one whole day.,,,,,,,,,,,,,,,,,,,,,,,23,,,99,,,,,,,,,,,,12,,,,,,,,,,,,,,,1,,,,,,,,,,,,,14,15,,,,,,,,,,,,,,,,,,,,,,,,99,,,,,,,,,,,,,,,,,,,,,,,,,,,,,,,,,,,,,,,,,,,,,,,,,,,,,,,,,,,,,,,,,,,,,,,,,,,,,,,,,,,,,,,,,,,,,,,,,,,,,,,,,,,,,,,,,,99,2,,1,,2,,6,2,,,,99,,,,,,,,,,,,99,,,,,,,,,,,,,,,,,,,,,,,,,,,,99,98,Farmer,2,99,99,2,28
125630106,1,2,4,32,1,1,1,9,Front camera takes beautiful and clear photos and able to adjust the night mode to get nice and sharp images when shooting at night time. Has a big memory size.,9,Big memory size and high battery capacity. Front and rear cameras take beautiful photos.,1,2,,,,,,,,,,,,,,,,,,,,,,,,6,,,,,,,,,,,,,,,15,,,,,,,,,,,,,,,,,,,,,,,,,14,15,,,,,,,,,,1,2,3,,5,,,,,,,,,,,,,,4,,,7,,,,,,2,,4,,,,,,,,,,3,,,,,,,,,,,,,,,,,,,,,,,,,,,99,,,,,,,,,,,,,,,,,,2,,4,,,,,9,,,,,,,,,,,,,,,,,,,,,,,,,,,,,,,,,,,14,,,9,,1,,2,,5,3,,,,,,98,F9,,,,,,,,,7,,,,,,,,,,,,,,,,,,,,,,,,,,,,99,10,,3,99,99,2,69
125630393,1,2,7,47,1,1,1,8,The device has a nice appearance and slim and thin body shape design with light weight. Smooth and responsive touchscreen.,8,Fast charging battery and long-used which is able to lasts for a long time.,,,,,,,,,,,,,,,,16,,,,,,,,,,99,,,,,,,,,,,,,,,,16,,,,,,,,,,,,,,,,,,,,,,,,14,15,,,,,20,21,,,,,,,,,,,,,,,,,,99,,,,,,,,,,,,,,,,,,,,,,,,,,,,,,,,,,,,,,,,,,,,,,,,,,,,,,,,,,,,,,,,,,,,,,,,,,,,,,,,,,,,,,,,,,,,,,,,,,,,,,4,,,,,,,,,,,,,9,,1,,2,,5,3,,,,,,6,,,,,,,,,,4,,,,,,,,,,,,,,,,,,,,,,,,,,,,99,9,,3,2,99,2,19
125630515,1,2,8,50,1,1,1,10,Both front and rear cameras take beautiful photos. And I use mobile banking apps which is proceeded transaction rapidly.,10,"Both front and rear cameras take beautiful and refine photos, no need to retouch or adjust the photos at all.",,,,,,,7,,,,,,,,,,,,,,,,,,It was dropped into water,99,,,,,,,,,,,,12,,,,,,,,,,,,,,,1,,,,,,,,,,,,,14,15,,,,,,,,,,,,,,,,,,,,,,,,99,,,,,,,,,,,,,,,,,,,,,,,,,,,,,,,,,,,,,,,,,,,,,,,,,,,,,,,,,,,,,,,,,,,,,,,,,,,,,,,,,,,,,,,,,,,,,,,,,,,,,,,,,,,,,,,,,,99,7,,4,,1,2,6,3,,,,,,99,,,,,,,,,,5,,,,,,,,,,,,,,,,,,,,,,,,,,,,99,10,,3,99,99,2,50
125630684,1,2,4,33,1,1,1,8,"The big memory size allows to store many photos, loading many apps to the device, not full memory easily. Easy and simple to use withouth any problem. Rear cameras take beautiful photos.  But front camera takes unnatural colored photos.",8,"Overall, this model has a good performance, smooth and good flow when using it. But there is no promotion like free gifts e.g., suitcase or Bluetooth speaker given at all.",,,,,,,,,,,,,13,,,,,,,,,,,,,7,,,,,,6,,,,,,,,,,,,,,,,,,,,,1,,,4,,,7,,,,,,,14,,,,,,,,,,,,,,,,,,,,,,,,,99,,,,,,,,,,,,,,,,,,,,,,,,,,,,,,,,,,,,,,,,,,,,,,,,,,,,,,,,,,,,,,,,,,,,,,,,,,,,,,,,,,,,,,,,,,,,,,,,,,,,,,,,,,,,,,,,,,99,3,,1,,2,,5,3,,,,,,9,,,,,,,,,,99,,,,,,,,,,,,12,,14,15,16,17,18,19,20,21,,,,,,,,3,,5,2,99,1,
125631702,1,1,9,60,1,1,1,10,The smartphone has a good performance in overall.,10,The smartphone has a good performance in overall.,,,,4,,,,,,,,,,,,,,,,,,,,,,99,,,,,,6,,,,,,,,,,,,,,,,,,,,,,,,,,,,,,,,,,,,,,,,,,22,,,,,,,,,,,,,,,,,99,,,,,,,,,,,,,,,,,,,,,,,,,,,,,,,,,,,,,,,,,,,,,,,,,,,,,,,,,,,,,,,,,,,,,,,,,,,,,,,,,,,,,,,,,,,,,,,,,,,,,,,,,,,,,,,,,,99,5,,1,,2,,6,3,,,,,,10,,,,,,,,,,4,,,,,,,,,,,,,,,,,,,,,,,,,,,,99,6,,2,99,99,2,75
125631810,1,2,8,51,1,2,1,10,This model is easy and simple to use or navigate.,10,High quality smartphone but not expensive price.,,,,,,,,,,,,,13,,,,,,,,,,,,,7,,,,,,,,,,,11,,,,,,,,,,,,,,,,1,2,,,,,,,,,,,,,,,,,,,,,,,,,,,,,,,,,,,,,99,,,,,,,,,,,,,,,,,,,,,,,,,,,,,,,,,,,,,,,,,,,,,,,,,,,,,,,,,,,,,,,,,,,,,,,,,,,,,,,,,,,,,,,,,,,,,,,,,,,,,,,,6,,,,,,,,,,,9,,1,,2,,4,5,,,,,,,,,,99,,,,,,2,,,,,,,,,,,,,,,,,,,,,,,,,,,I want more durable smartphone which is able to use longer,,11,,3,1,4,2,66
125631891,1,1,6,44,1,1,1,10,High specifications offered and both cameras take beautiful photos.,10,High specifications offered and both cameras take beautiful photos.,,,,,,,,,,,,,,14,,,,,,,,,,,,99,,,,,,,,,,,,12,,,,,,,,,,,,,,,1,,,,,,,,,,,,,,,,,,,,,,,,,,,,,,,,,,,,,,99,,,,,,,,,,,,,,,,,,,,,,,,,,,,,,,,,,,,,,,,,,,,,,,,,,,,,,,,,,,,,,,,,,,,,,,,,,,,,,,,,,,,,,,,,,,,,,,,,,,,,,,,,,,,,,,,,,99,9,,1,,2,,4,3,,,,,,98,Reno4,,,,,,,,,9,,,,,,,,,,,,,,,,,,,,,,,,,,,,99,9,,1,99,99,2,16
125645592,1,1,3,27,1,1,1,9,This model has a nice appearance and body design as well as the design of rear cameras. Front camera takes clear and vivid-colored photos.,9,Easy and convenient to use  or navigate smartphone. Has a stable system without interuption when using it.,,,,,,,,,,,,,13,,,,,,,,,,,,,99,,,,,,,,,,,,12,,,,,,,,,,,,,,,1,,,,,6,7,,,,,,,,,,,,,,,,,,,,,,,,,,,,,,,,99,,,,,,,,,,,,,,,,,,,,,,,,,,,,,,,,,,,,,,,,,,,,,,,,,,,,,,,,,,,,,,,,,,,,,,,,,,,,,,,,,,,,,,,,,,,,,,,,,,,,,,,,,,,,,,,,,,99,9,,1,,2,,6,3,,,,,,99,,,,,,,,,,99,,,,,,,,,,,,,,,,,,,,,,,,,,,,99,10,,3,2,99,2,73
125645758,1,2,9,55,1,2,1,10,Rear cameras take beautiful and clear photo colors. Wide screen display size which is clearly seen.,10,Fast processing speed and compact size which is easy and convenient to carry out as well as good grip. Not expensive price.,,,,,,,,,,,,,,,,,,,,,,,,,It was damaged,2,,,,,,,,,,,,12,,,,,,,,,,,,,,,1,,,,,,,,,,,,,14,15,,,,,,,,,,,,,,,,,,,,,,,,99,,,,,,,,,,,,,,,,,,,,,,,,,,,,,,,,,,,,,,,,,,,,,,,,,,,,,,,,,,,,,,,,,,,,,,,,,,,,,,,,,,,,,,,,,,,,,,,,,,,,,,,,,,,,,,,,14,,,7,,4,,2,,5,2,,,,99,,,,,,,,,,,,2,,,,,,,,,,,,,,,,,,,,,,,,,,,,99,98,Farmer,3,99,99,2,12
125646384,1,2,6,42,1,1,1,8,"Front and rear cameras take beautiful, sharp and high resolution photos.",10,"Front and rear cameras take beautiful, sharp and high resolution photos. Fast processing speed and smooth and responsive touchscreen.",,,,,,,,,,,,,,,,,,,,,,,,,It was damaged,4,,,,,,,,,,,,12,,,,,,,,,,,,,,,1,2,,,,,,,,,,,,14,15,,,,,,,,,,,,,,,,,,,,,,,,99,,,,,,,,,,,,,,,,,,,,,,,,,,,,,,,,,,,,,,,,,,,,,,,,,,,,,,,,,,,,,,,,,,,,,,,,,,,,,,,,,,,,,,,,,,,,,,,,,,,,,,,,,,,,,,,,,,99,7,,4,,2,,6,6,,,,,,,,,,,,99,,,,6,,,,,,,,,,,,,,,,,,,,,,,,,,,,99,9,,2,3,99,2,51
125646438,1,1,7,48,1,1,1,8,"Fast processing speed, smooth and responsive touchscreen. Front and rear cameras take beautiful and sharp photos.",8,"Fast processing speed, smooth and responsive touchscreen. Front and rear cameras take beautiful and sharp photos. Has a nice appearance and body design which suits the grip.",,,,,,,,,,,,,,,,,,,,,,,,,It was damaged,2,,,,,,,,,,,,12,,,,,,,,,,,,,,,1,,,,,6,,,,,,,,14,15,,,,,,,,,,,,,,,,,,,,,,,,99,,,,,,,,,,,,,,,,,,,,,,,,,,,,,,,,,,,,,,,,,,,,,,,,,,,,,,,,,,,,,,,,,,,,,,,,,,,,,,,,,,,,,,,,,,,,,,,,,,,,,,,,,,,,,,,,,,99,7,,1,,2,,6,3,,,,,,99,,,,,,,,,,99,,,,,,,,,,,,,,,,,,,,,,,,,,,,99,9,,4,99,99,2,20
125646821,1,1,8,51,1,2,1,8,Clear and loud sound from speakers. Has a nice appearance and beautiful body color design.,9,Clear and loud sound from speakers. Has a nice appearance and beautiful body color design. Fast charging speed and durable battery.,,,,4,,,,,,,,,,,,,,,,,,,,,,9,,,,,,,,,,,,,,,15,,,,,,,,,,,,1,2,,,,,,,,,,12,,,,,,,,20,21,,,,,2,,,,6,,,,,,,,,,,,,,,,,,,,,,,3,,,,,,,,,,,,,,,,,,,,,,,,,,,,,,,,,,,,,,,,,,,,,,99,,,,,,,,,1,,,4,,,,,,,,,,,,,,,,3,,,,,,,,,,Speaker,,,,,,,,,,,,,,,Siamphone.com,,3,,3,,1,2,6,2,,,,98,A6+,,,,,,,,,,,11,,,,,,,,,,,,,,,,16,17,18,19,,,,,,,,,,9,,5,5,10,2,68
125647096,1,1,6,41,1,1,1,10,Front and rear cameras take clear and sharp and refined photos. The appearance design of this model also beautiful with nice boyd  color.,10,Front and rear cameras take clear and sharp and refined photos. The appearance design of this model also beautiful with nice boyd  color. Smooth and responsive touchscreen with wide  screen display size.,,,,,,,,,,10,,,,,,,,,,,,,,,,99,,,,,,,,,,,,,,,,,,,,,21,,,,,,1,2,,,,,,,,,11,,,14,15,,,,,,,,,,,,,,,,,,,,,,,,99,,,,,,,,,,,,,,,,,,,,,,,,,,,,,,,,,,,,,,,,,,,,,,,,,,,,,,,,,,,,,,,,,,,,,,,,,,,,,,,,,,,,,,,,,,,,,,,,,,,,,,,,,,,,,,,,,,99,5,,4,,2,,5,5,,,,,,,,,,99,,,,,,4,,,,,,,,,,,,,,,,,,,,,,,,,,,,99,98,General labour,2,2,2,1,
125647151,1,1,9,61,1,1,1,10,Easy to use device. Rear cameras take clear and sharp and refined photos.,10,"Easy to use device. Rear cameras take clear and sharp and refined photos. Large screen display size with high definition, colorful and vivid-colored screen.",,,,,,,,,,,,,13,,,,,,,,,,,,,2,,,,,,,,,,,11,,,,,,,,,,,,,,,,1,2,,,,,,,,10,11,,,14,,,,,,,,,,,,,,,,,,,,,,,,,99,,,,,,,,,,,,,,,,,,,,,,,,,,,,,,,,,,,,,,,,,,,,,,,,,,,,,,,,,,,,,,,,,,,,,,,,,,,,,,,,,,,,,,,,,,,,,,,,,,,,,,,,,,,,,,,,,,99,7,,1,,2,,6,4,,,,,,,,98,Redmi Note 10,,,,,,,99,,,,,,,,,,,,,,,,,,,,,,,,,,,,99,9,,3,4,6,1,
125647198,1,2,5,39,1,1,1,8,"Has a nice appearance and body design with beautiful body color. The selfie photos from front camera are beautiful, refined and sharp photos.",8,Big memory size. Front camera takes beautiful photos. Has a nice appearance design.,,,,,,,,,,,,,,,,,,,,,,22,,,,99,,,,,,,,,,,,12,,,15,,,,,,,,,,,,1,,,,,,,,,,,,,14,,16,,,,,,,,,,2,3,,5,,,,,,,,,,,,,,,,,,,,,,,,3,4,,,,,,,,,,,,,,,,99,,,,,,,,,,,,,,,,,,,,,99,,,,,,,,,,,,,,,,,1,,,,,,,,,,,,,,,,,,,,4,5,,,,,,,,,,,,,,,,,,,,,,,,99,9,,1,,2,,4,2,,,,3,,,,,,,,,,,,5,,,,,,,,,,,,,,,,,,,,,,,,,,,,99,10,,3,2,99,1,
125647290,1,1,5,38,1,1,1,9,CPU and processing system provide fast responses. Big ROM capacity has a large storage space. There is always updated the latest functions into the device.,9,"The specifications matches with the price. Overall, the smartphone has a good usage performance, smooth and good flow when using it.",,,,,,,,,,,,,,,,16,,,,,,,,,,6,,,,,,,,,,,,,,,,,,,,,21,,,,,,1,,,,5,6,7,,,,,,,,,,,,,,,22,,,,,3,4,5,,7,,,,,,,,,,,,,,,,,,,,,,,,,,,,,,,,,,,,6,7,,,,,3,,,,,,,,,,,,,,,,,,99,,,,,,,,,1,,,,,,,,1,,,,,,,,,,,,,,,,,1,,,4,5,,,,,,,,,,,,,,,,,,,,,,,,99,7,,1,,2,,5,4,,,,,,,,99,,,,,,,,5,,,,,,,,,,,,12,,14,15,,,,,,,,,,,,,,3,,5,99,99,2,29
