125560872,1,1,7,48,1,1,1,10,Easy to use or navigate device. Front and rear cameras take clear and sharp photos. Fast processing speed. Long-used battery with fast charging speed.,10,Fast processing speed. Easy to use or navigate device. Long-used battery with fast charging speed. Front and rear cameras take clear and sharp photos. ,,,,4,,,,,,,,,13,,,,,,,,,,,,,7,,,,,,,,,,,11,,,,,,,,,,,,,,,,1,,,,,6,7,,,,,,,14,15,,,,,,,,,,,2,,,,,,,,,,,,,,,,,,,,,,,,,,,,,,,,,,,99,,,,,,,,,,,,,,,,,,,,,,,,,,,,,,,,,,,,,,,,,,,,,,,1,,,,,,,,9,,,,,,,,,,,,4,,6,7,,,,,,,1,,,,,,,,,,,,,,,,3,,3,,2,,6,2,,,,98,J7+,,,,,,,,,,,6,,,,,,,,,,,,,,,,,,,,,,,,,,,,99,3,,4,4,99,2,9
125575197,1,2,6,40,1,1,1,9,I like the overall design with slim and thin body shape and nice cover color of this model. Front camera takes beautiful selfie photos. Has the cooling system available inside the smartphone.,9,Middle price range or affordable price. The functions meet my usage purposes. And the cameras take beautiful photos with big memory size.,,,,,,,,,,,,,,,,16,,,,,,,,,,99,1,,,,,,,,,,,,,,,,,,,,,,,,,,1,,,,,,,,,,,,,14,15,,,,,,21,,,,,,3,,,,,,,,,,,,,,,,,,,,,,,,,,,,,,,,,,,1,,,,,,,,,,,,,,,,,,,,,,,,,,,,,,,,,,,,,,,,,,,,,,,,,,,,,,9,,,,,,,,,,,,,,,,,,,,,,,,,,,,,,,,,,,,,99,7,,3,,2,,5,3,,,,,,9,,,,,,,,,,9,,,,,,,,,,,,,,,,,,,,,,,,,,,,99,3,,5,2,99,1,
125575396,1,2,3,29,1,1,1,10,"Both front and rear cameras take beautiful, sharp and natural colored portrait photos. ",9,The specifications of this model match the price. The system provides fast processing speed and smooth and good flow.,,,,,,,,,,,,,13,,,,,,,,,,,,,7,,,,,,,,,,,,12,,,,,,,,,,,,,,,,,,,,6,7,,,,,,,14,,,17,,,,,,,,,,,,,,,,,,,,,,99,,,,,,,,,,,,,,,,,,,,,,,,,,,,,,,,,,,,,,,,,,,,,,,,,,,,,,,,,,,,,,,,,,,,,,,,,,,,,,,,,,,,,,,,,,,,,,,,,,,,,,,,,,,,,,,,,,99,3,,1,,2,,5,2,,,,99,,,,,,,,,,,,4,,,,,,,,,,,,,,,,,,,,,,,,,,,,99,3,,3,1,99,2,60
125575438,1,2,1,16,1,1,1,9,"I am satisfied with smooth and good flow when playing games. Front and rear cameras take beautiful, clear and sharp photos. No complaints.",10,I like the sound quality from speakers which is clear and loud.,,,,,,,,,,10,,,,,,,,,,,,,,,,3,,,,,,6,,,,,,,,,,,,,,,,,,,,,,,,,,,,,,,,,,14,15,,,,,,,,,,,,,,,,,,,,,,,,99,,,,,,,,,,,,,,,,,,,,,,,,,,,,,,,,,,,,,,,,,,,,,,,,,,,,,,,,,,,,,,,,,,,,,,,,,,,,,,,,,,,,,,,,,,,,,,,,,,,,,,,,,,,,,,,,,,99,9,,1,,2,,4,3,,,,,,98,A53,,,,,,,,,3,,,,,,,,,,,,,,,,,,,,,,,,,,,,99,1,,3,99,99,2,5
125575507,1,2,2,24,1,1,1,8,"I am satisfied with fast processing speed. This model has a light weight. But rear cameras is unclear when using zoom mode, the photos are broken and not beautiful.",5,I like beautiful appearance design. Clear and loud sound. ,,,,,,,,,,,,,,,,,,,,,,,,,It was heat up fast,7,,,,,,6,,,,,,,,,,,,,,,,,,,,,1,,,,,6,7,,,,,,,,,,,,,,,,,,,,,,,,,,,,,,,,99,,,,,,,,,,,,,,,,,,,,,,,,,,,,,,,,,,,,,,,,,,,,,,,,,,,,,,,,,,,,,,,,,,,,,,,,,,,,,,,,,,,,,,,,,,,,,,,,,,,,,,,,,,,,,,,,,,99,9,,1,,2,,5,3,,,,,,99,,,,,,,,,,4,,,,,,,,,,,,,,,,,,,,,,,,,,,Should  improve better cooling system or heat dissipation,,2,,4,99,99,1,
125575540,1,2,99,,1,1,1,9,The smartphone is easy to use. The system is stable makes the device runs smoothly without hangs or lags. Long-used battery and big ROM and RAM capacity.,9,The device has a good performance with not expensive price. The cameras take beautiful photos. Has a big memory size offered.,,,,,,,,,,10,,,,,,,,,,,,,,,,3,,,,,,,,,,,,12,,,,,,,,,,,,,,,1,,,,,,7,,,,,,,,,,,,,,,,,,,,,,,,,,,,,,,,99,,,,,,,,,,,,,,,,,,,,,,,,,,,,,,,,,,,,,,,,,,,,,,,,,,,,,,,,,,,,,,,,,,,,,,,,,,,,,,,,,,,,,,,,,,,,,,,,,,,,,,,,,,,,,,,,,,99,7,,4,,2,,4,3,,,,,,7,,,,,,,,,,99,,,,,,,,,,,,,,,,16,17,,,,,,,,,,,,10,,3,2,99,2,9
125575823,1,1,5,36,1,1,1,10,"I am satisfied with rear cameras take beautiful, clear and natural colored photos.",10,I like fast processing speed and clear and loud sound.,,,,,,,,,,,,,13,,,,,,,,,,,,,7,,,,,,6,,,,,,,,,,,,,,,,,,,,,,,,,,,7,,,,,,,14,15,,,,,,,,,,,,,,,,,,,,,,,,99,,,,,,,,,,,,,,,,,,,,,,,,,,,,,,,,,,,,,,,,,,,,,,,,,,,,,,,,,,,,,,,,,,,,,,,,,,,,,,,,,,,,,,,,,,,,,,,,,,,,,,,,,,,,,,,,,,99,9,,1,,2,,6,5,,,,,,,,,,98,Y91,,,,,3,,,,,,,,,,,,,,,,,,,,,,,,,,,,99,9,,99,99,99,1,
125575975,1,2,9,64,1,1,1,10,Easy to use smartphone and smooth and good flow when using the device. Clear and loud sound when calls.,10,"The device has a good performance and easy to use, smooth and good flow when using it. Clear and loud sound when calls.",,,,,,,,,,,,,,,,,,,,,,,,,My previous mobile phone is not smartphone,99,,,,,,,,,,,,12,,,,,,,,,,,,,,,1,,,,,,,,,,11,12,,,,,,,,,,,,,,,,,,,,,,,,,,,99,,,,,,,,,,,,,,,,,,,,,,,,,,,,,,,,,,,,,,,,,,,,,,,,,,,,,,,,,,,,,,,,,,,,,,,,,,,,,,,,,,,,,,,,,,,,,,,,,,,,,,,,,,,,,,,,,,99,2,,3,,2,,6,98,TRUE,,,,,,,,,,,,,,,99,,,,,,,,,,,,,,,,,,,,,,,,,,,,99,10,,3,2,99,2,18
125576304,1,2,6,40,1,1,1,10,"Smooth and good flow, easy to use or navigate smartphone with long-used battery which lasts for a long time.",10,Long-used battery. Smooth and good flow as well as easy to use device.,,,,,,,,,,,,,,,,,,,,,,22,,,,99,,,,,,,,,,,,12,,,,,,,,,,,,,,,,,,,,6,7,,,,,,,,,,,,,20,,,,,,,,,5,,,,,,,,,,,,,,,,,,,,,,,,,,,,,,,,,,,,,,,,,,,,,,,,,,,,,,,,,,,,,,99,,,,,,,,,,,,,,,,,1,,,,,,,,9,,,,,,,,,,,,4,5,,,,,,,,,,,,,,,,,,,,,,14,,,3,,1,,2,,6,3,,,,,,99,,,,,,,,,,99,,,,,,,,,,,,,,,,,,,,,,,,,,,,99,9,,6,99,99,2,48
125576561,1,2,6,43,1,1,1,10,"Smooth and good flow system which allows Facebook and Line apps fast and responsive. Clear and loud sound from speakers. And there is smoothly performing screen display when scrolling up and down, no hangs or lags.",10,"Has a nice appearance design with not expensive price. Front and rear cameras take refined, clear and high resolution photos.",,2,,,,,,,,,,,,,,,,,,,,,,,,99,,,,,,,,,,,,,,,15,,,,,,,,,,,,,,,,,6,7,,,,,,,,,,,,,,,,,,,,,,,,,,,,,,,,99,,,,,,,,,,,,,,,,,,,,,,,,,,,,,,,,,,,,,,,,,,,,,,,,,,,,,,,,,,,,,,,,,,,,,,,,,,,,,,,,,,,,,,,,,,,,,,,,,,,,,,4,,,,,,,,,,,,,9,,1,,2,,3,5,,,,,,,,,,2,,,,,,6,,,,,,,,,,,,,,,,,,,,,,,,,,,,99,9,,3,2,99,2,24
125576795,1,1,5,36,1,2,1,10,Fast processing speed when using the  device. Front and rear cameras take clear and sharp photos. Wide screen display size and clear and loud sound. Long-usesd battery and fast charging speed. Big memory size.,10,Big memory size. Fast processing speed when using the  device. Long-used battery and fast charging speed. Wide screen display. Front and rear cameras take clear and sharp photos.,1,,,,,,,,,,,,,,,,,,,,,,,,,99,,,,,,,,,,,,12,,,,,,,,,,,,,,,,,,,,6,7,,,,,,,14,15,,,,,20,,,,,,,,,,,,,,,,,,,99,,,,,,,,,,,,,,,,,,,,,,,,,,,,,,,,,,,,,,,,,,,,,,,,,,,,,,,,,,,,,,,,,,,,,,,,,,,,,,,,,,,,,,,,,,,,,,,,,,,,,,,,,,,,,,,,,,99,2,,3,,2,,5,5,,,,,,,,,,99,,,,,,99,,,,,,,,,,,,,,,,,,,,,,,,,,,,99,3,,3,2,2,2,21
125576863,1,1,3,27,1,1,1,8,I  am satisfied with fast processing speed when using the smartphone. Front and rear cameras take clear and beautiful photos. No complaints.,9,I like fast charging speed as well as nice rectangular appearance and design with light weight.,,,,,,,,,,,,,,,,,,,,,,22,,,,7,,,,,,,,,,,,,13,,,,,,,,,,,,,,1,,3,,,,,,,,,,,,,,,,,,,,,,,,,,,,,,,,,,,,99,,,,,,,,,,,,,,,,,,,,,,,,,,,,,,,,,,,,,,,,,,,,,,,,,,,,,,,,,,,,,,,,,,,,,,,,,,,,,,,,,,,,,,,,,,,,,,,,,,,,,,,,,,,,,,,,,,99,9,,1,,2,,6,3,,,,,,98,F9,,,,,,,,,8,,,,,,,,,,,,,,,,,,,,,,,,,,,,99,4,,4,99,99,1,
125576884,1,1,3,28,1,1,1,9,"Smooth and good flow when playing online games, no hangs or lags and the screen display has a bright light. Has a slim body shape which is able to carry out or hold in hands without slippery even when playing games.",10,Fast processing speed. Smooth and good flow when playing games. Has a big memory size and RAM expandable offered. The price matches with the specifications.,,,,,,,,,,,,,13,,,,,,,,,,,,,7,,,,,,,,,,,,,,,,,,18,,,,,,,,,,,,,,6,7,8,,,,,,,,,,,,,,,,,,,3,4,5,,,,,,,,,,,,,,,,,,,,,,,,,,,,,,,,,,,3,,,,,,,1,,,,,,,,,,,,,,,,,,,V25,,,,,,,,,,,,,,,,,,,,,,,,,,9,,,,,14,,,,,,,,,,,,,,,,,,,,,,,,,,,,,,,,99,3,,1,,2,,4,4,,,,,,,,7,,,,,,,,8,,,,,,,,,,,,12,,14,15,,,,,,,,,,,,,,10,,3,2,99,1,
125576940,1,1,5,39,1,1,1,8,"I am satisfied with fast processing speed. Rear cameras take beautiful and sharp photos, no need  to retouch or adjust the images automatically. ",10,I like fast charging speed and long-used or durable battery.,,,,,,,,,,,,,,,,,,,,,,22,,,,7,,,,,,6,,,,,,,,,,,,,,,,,,,,,1,,,,,6,,,,,11,,,,,,,,,,,,,,,,,,,,,,,,,,,,99,,,,,,,,,,,,,,,,,,,,,,,,,,,,,,,,,,,,,,,,,,,,,,,,,,,,,,,,,,,,,,,,,,,,,,,,,,,,,,,,,,,,,,,,,,,,,,,,,,,,,,,,,,,,,,,,,,99,9,,1,,2,,6,3,,,,,,99,,,,,,,,,,7,,,,,,,,,,,,,,,,,,,,,,,,,,,,99,9,,2,99,99,2,47
125577066,1,2,5,36,1,1,1,10,"I like front camera takes clear, sharp, beautiful and natural colored photos. Fast charging speed. No complaints.",10,I like long-used battery which lasts for more than one day.,,,,,,,,,,,,,,,,,,,,,,,,,The sound was very low,7,,,,,,6,,,,,,,,,,,,,,,,,,,,,,,,,,,,,,,,,,14,15,,,,,,,,,,,,,,,,,,,,,,,,99,,,,,,,,,,,,,,,,,,,,,,,,,,,,,,,,,,,,,,,,,,,,,,,,,,,,,,,,,,,,,,,,,,,,,,,,,,,,,,,,,,,,,,,,,,,,,,,,,,,,,,,,,,,,,,,,14,,,9,,1,,2,,6,3,,,,,,98,A5,,,,,,,,,99,,,,,,,,,,,,,,,,,,,,,,,,,,,,99,3,,3,99,99,2,68
125577105,1,1,4,34,1,1,1,8,"Has a nice body color and beautiful and more appearance design. Rear cameras take sharp, high resolution and accurate focus. But this model is not supported 5G.",8,There are many photographic functions and modes inside rear camera for adjusting or retouching colors and lights as many as I want.,,,,,,,,,,,,,,,,16,,,,,,,,,,99,,,,,,6,,,,,,,,,,,,,,,,,,,,,,,,,,,,,,,,,,14,15,,,,,,,,,,,,,,,,,,,,,,,,99,,,,,,,,,,,,,,,,,,,,,,,,,,,,,,,,,,,,,,,,,,,,,,,,,,,,,,,,,,,,,,,,,,,,,,,,,,,,,,,,,,,,,,,,,,,,,,,,,,,,,,,,,,,,,,,,,,99,3,,1,,1,3,5,3,,,,,,5,,,,,,,,,,3,,,,,,,,,,,,,,,,,,,,,,,,,,,,99,3,,4,3,99,1,
125577316,1,2,5,35,1,1,1,8,"I am satisfied with clear and loud sound adn fast processing speed when using the device. However, the system is lag or hang and many games download to the device so often.",6,This model offers fast charging speed and long-used battery.,,,,,,,,,,,,,,,,,,,,,,,,,It was damaged,7,,,,,,6,,,,,,,,,,,,,,,,,,,,,,,,,,6,7,,,,,,,,,,,,,,,,,,,,,,,,,,,,,,,,99,,,,,,,,,,,,,,,,,,,,,,,,,,,,,,,,,,,,,,,,,,,,,,,,,,,,,,,,,,,,,,,,,,,,,,,,,,,,,,,,,,,,,,,,,,,,,,,,,,,,,,,,,,,,,,,,14,,,3,,1,,2,,6,1,,3,,,,,,,,,,,,,,13,,,,,,,,,,,,,,,,,,,,,,,,,,,"I do not want an auto uploading data e.g., games into the smartphone",,4,,5,99,99,1,
125577388,1,1,7,48,1,1,1,9,Fast charging battery and big memory size makes the device is able to store many photographing files. And there is dual speakers provide clear and loud sound.,9,Smooth and good flow when using the device and fast and responsive very well when accessing through apps.,,,,,,,,,,,,,13,,,,,,,,,,,,,7,,,,,,,,,,,,12,,,,,,,,,,,,,,,,,,,5,6,7,,,,,,,,,,,,,20,21,,,,,,3,,,,,,,,,,,,,,,,,,,,,,,,,,,,,,,,,,,,,,,,6,7,,,,,,,,,,,,,,,,,,,,,,,,,,,,,,,,,,,,,,,,1,,,,,,,,,,,,,,,,,,,3,,5,,,,,,,,,,,,,,,,,,,,,,,,99,3,,4,,2,,5,3,,,,,,98,F1s,,,,,,,,,99,,,,,,,,,,,,,,,,,,,,,,,,,,,,99,10,,99,99,99,1,
125577492,1,2,5,37,1,1,1,8,"Nice appearance design, long-used battery and fast charging speed. Clear and loud sound. Easy to use or navigate system but lag or  hang sometimes.",8," Easy to use or navigate smartphone. Clear and loud sound. Nice appearance design, long-used battery and fast charging speed. But I rate 8 points because there is hang or lag sometimes.",,,,,,,,,,,,,13,,,,,,,,,,,,,7,,,,,,,,,,,,12,,,,,,,,,,,,,,,1,,,,,,,,,,,,,14,15,,,,,,,,,,,,,,,,,,,,,,,,99,,,,,,,,,,,,,,,,,,,,,,,,,,,,,,,,,,,,,,,,,,,,,,,,,,,,,,,,,,,,,,,,,,,,,,,,,,,,,,,,,,,,,,,,,,,,,,,,,,,,,,,,,,,,,,,,,,99,2,,3,,1,3,6,2,,,,6,,,,,,,,,,,,99,,,,,,,,,,,,,,14,,,,,,,,,,,,,,,2,,3,3,3,2,14
125577710,1,1,8,53,1,1,1,10,Durable smartphone. Long-used battery with fast charging speed. Smooth and good flow when using the device. Clear and loud sound. Front and rear cameras take clear and sharp photos.,10,Smooth and good flow when using the device. Long-used battery with fast charging speed. Durable smartphone. Front and rear cameras take clear and sharp photos.,,,,,,,,,,,,,,,,,,,,,,,,,It was damaged,99,,,,,,,,,,,,12,,,,,,,,,,,,,,,1,,,,,,,,,,,,13,,,,,,,20,,,,,,,,,,,,,,,,,,,99,,,,,,,,,,,,,,,,,,,,,,,,,,,,,,,,,,,,,,,,,,,,,,,,,,,,,,,,,,,,,,,,,,,,,,,,,,,,,,,,,,,,,,,,,,,,,,,,,,,,,,,,,,,,,,,,,,99,7,,1,,2,,6,99,,,,,,,,,,,,,,,,99,,,,,,,,,,,,,,,,,,,,,,,,,,,,99,10,,3,3,99,2,13
125577928,1,2,3,26,1,1,1,10,"I am satisfied with rear cameras take more beautiful, clearer and natural colored photos than front camera. And smooth and good flow when using the device.",9,I like clear  and loud sound with interuption noise reducing function. And fast charging speed.,,,,,,,,,,,,,,,,,,,,,,22,,,,99,,,,,,6,,,,,,,,,,,,,,,,,,,,,,,,,,6,7,,,,,,,,,,,,,,,,,,,,,,,,,,,,,,,,99,,,,,,,,,,,,,,,,,,,,,,,,,,,,,,,,,,,,,,,,,,,,,,,,,,,,,,,,,,,,,,,,,,,,,,,,,,,,,,,,,,,,,,,,,,,,,,,,,,,,,,,,,,,,,,,,14,,,9,,1,,2,,6,5,,,,,,,,,,99,,,,,,3,,,,,,,,,,,,,,,,,,,,,,,,,,,,99,3,,2,99,99,2,14
125578013,1,1,2,23,1,1,1,10,I am satisfied  with smooth and good flow when using the device. Front camera take clear and sharp photos.,9,I like more beautiful appearance design with rectangular body shape. And has a wide screen display size.,,,,,,,,,,,,,,,,,,,,,,,,,It was damaged,7,,,,,,6,,,,,,,,,,,,,,,,,,,,,1,,3,,,6,7,,,,,,,,,,,,,,,,,,,,,,,,,,,,,,,,99,,,,,,,,,,,,,,,,,,,,,,,,,,,,,,,,,,,,,,,,,,,,,,,,,,,,,,,,,,,,,,,,,,,,,,,,,,,,,,,,,,,,,,,,,,,,,,,,,,,,,,,,,,,,,,,,,,99,9,,1,,2,,6,3,,,,,,99,,,,,,,,,,6,,,,,,,,,,,,,,,,16,,,,20,,,,,,,,,3,,5,99,99,2,14
125578109,1,1,4,33,1,1,1,9,I am satisfied with fast processing speed and big memory size. No complaints.,9,"I like front and rear cameras take beautiful, clear and sharp photos. Fast charging speed and long-used battery which lasts for more than one day.",,2,,,,,,,,,,,13,,,,,,,,,,,,,7,,,,,,6,,,,,,,,,,,,,,,,,,,,,,,,,,6,7,,,,,,,,,,,,,,,,,,,,,,,,,,,,,,,,99,,,,,,,,,,,,,,,,,,,,,,,,,,,,,,,,,,,,,,,,,,,,,,,,,,,,,,,,,,,,,,,,,,,,,,,,,,,,,,,,,,,,,,,,,,,,,,,,,,,,,,,,,,,,,,,,,,99,9,,1,,2,,6,6,,,,,,,,,,,,99,,,,6,,,,,,,,,,,,,,,,,,,,,,,,,,,,99,3,,3,99,99,1,
125578177,1,2,5,35,1,1,1,8,"Nice appearance design with durable battery. Smooth and good flow, no hangs or lags when playing games as well as using this device.",8,"High specifications e.g., big ROM and RAM capacity. Front and rear cameras take beautiful and clear photos.",,,,,,,,,,,,,,,,,,,,,,,,,It was damaged,99,,,,,,,,,,,,,,,,16,,,,,,,,,,,1,,,,,6,7,,,,,,,,,,,,,,,,,,,,,,,,,,,,,,,,99,,,,,,,,,,,,,,,,,,,,,,,,,,,,,,,,,,,,,,,,,,,,,,,,,,,,,,,,,,,,,,,,,,,,,,,,,,,,,,,,,,,,,,,,,,,,,,,,,,,,,,,,,,,,,,,,,,99,9,,1,,2,,5,5,,,,,,,,,,99,,,,,,99,,,,,,,,,,,,,,,,,,,,,,,,,,,,99,10,,3,2,99,2,60
125578187,1,1,8,52,1,1,1,8,Smooth and good flow when using the mobile phone. Front and rear cameras take clear and sharp photos. Wide screen display size. Long-used battery with fast charging speed.,9,Wide screen display size. Smooth and good flow when using the mobile phone. Front and rear cameras take clear and sharp photos. Long-used battery with fast charging speed.,,,,,,,,,,,,,,,,,,,,,,,,,It was damaged,99,,,,,,,,,,,,12,,,,,,,,,,,,,,,,,,,,,,,,,,,,14,15,,,,,20,,,,,,,,,,,,,,,,,,,99,,,,,,,,,,,,,,,,,,,,,,,,,,,,,,,,,,,,,,,,,,,,,,,,,,,,,,,,,,,,,,,,,,,,,,,,,,,,,,,,,,,,,,,,,,,,,,,,,,,,,,,,,,,,,,,,,,99,5,,1,,2,,6,99,,,,,,,,,,,,,,,,2,,,,,,,,,,,,,,,,,,,,,,,,,,,,99,2,,5,99,99,2,46
125578202,1,2,3,28,1,1,1,8,I am satisfied with fast processing when using the device. Front and rear cameras take beautiful photos. No complaints.,9,This model has a nice rectangular appearance and body design.,,,,,,,,,,,,,13,,,,,,,,,,,,,7,,,,,,6,,,,,,,,,,,,,,,,,,,,,1,,3,,,,,,,,,,,,,,,,,,,,,,,,,,,,,,,,,,,,99,,,,,,,,,,,,,,,,,,,,,,,,,,,,,,,,,,,,,,,,,,,,,,,,,,,,,,,,,,,,,,,,,,,,,,,,,,,,,,,,,,,,,,,,,,,,,,,,,,,,,,,,,,,,,,,,,,99,9,,1,,2,,2,3,,,,,,98,Reno8z,,,,,,,,,9,,,,,,,,,,,,,,,,,,,,,,,,,,,,99,4,,3,99,99,2,62
125578434,1,2,5,39,1,1,1,9,Easy to use smartphone and fast processing speed. Fast charging and long-used battery. Rear cameras take clear and sharp photos. But front camera take pale colored photos.,9,Fast processing speed and easy to use smartphone. Rear cameras take clear and sharp photos. Fast charging and long-used battery.,,,,,,,,,,,,,,,,,,,,,,,,,It was damaged,7,,,,,,,,,,,,12,,,,,,,,,,,,,,,1,,,,,,,,,,,,,,,,,,,20,21,,,,,,,,,,,,,,,,,,99,,,,,,,,,,,,,,,,,,,,,,,,,,,,,,,,,,,,,,,,,,,,,,,,,,,,,,,,,,,,,,,,,,,,,,,,,,,,,,,,,,,,,,,,,,,,,,,,,,,,,,,,,,,,,,,,,,99,7,,1,,2,,6,3,,,,,,99,,,,,,,,,,4,,,,,,,,,,,,,,,,,,,,,,,,,,,,99,9,,5,99,99,2,21
125578804,1,2,8,50,1,1,1,10,"Nice appearance and body design. Fast processing, smooth and good flow. The system is stable and clear and loud sound offered. Front and rear cameras take clear and sharp photos.",10,"Fast processing, smooth and good flow. Front and rear cameras take clear and sharp photos. And clear and loud sound offered. ",,,,,,,,,,,,,,,,,,,,,,,,,It was dropped to the floor then the sound was very low,7,,,,,,,,,,,,12,,,,,,,,,,,,,,,1,,,,,,,,,,,12,,14,15,,,,,,,,,,,,,,,,,,,,,,,,99,,,,,,,,,,,,,,,,,,,,,,,,,,,,,,,,,,,,,,,,,,,,,,,,,,,,,,,,,,,,,,,,,,,,,,,,,,,,,,,,,,,,,,,,,,,,,,,,,,,,,,,,,,,,,,,,,,99,2,,1,,2,,5,99,,,,,,,,,,,,,,,,7,,,,,,,,,,,,,,,,,,,,,,,,,,,,99,11,,1,99,99,2,9
125579185,1,1,7,45,1,1,1,10,Fast processing speed when using this model. And the speakers provide loud sound. Front and rear cameras take clear and sharp photos. Wide screen display size and is able to auto adjusting light. But the battery drains fast.,9,Fast processing speed when using this model. Wide screen display size and is able to auto adjusting light. But the battery drains fast. And the speakers provide loud sound. Front and rear cameras take clear and sharp photos. ,,,,,,,,,,10,,,,,,,,,,,,,,,,5,,,,,,,,,,,,12,,,,,,,,,,,,,,,1,,,,,,,,,,,,,14,15,,,,,,,,,,,,,,5,,,,,,,,,,,,,,,,,,,,,,,,,,,,,,,,,,,,,,,,,,,,,,,,,,,,,,,,,,,,,,99,,,,,,,,,,,,,,,,,1,,,,,,,,,,,,,,,,,,2,,,,6,7,,,,,,,,,,,,,,,,,,,,14,,,3,,3,,2,,5,5,,,,,,,,,,99,,,,,,99,,,,,,,,,,,,,,14,15,,,,,,,,,,,,,,2,,3,2,99,2,38
125579356,1,1,3,26,1,1,1,10,Easy to use smartphone and smooth and good flow when using the device. Front and rear cameras take clear and sharp photos. Long-used battery with fast charging speed.,10,Smooth and good flow when using the device. Long-used battery with fast charging speed. Front and rear cameras take clear and sharp photos. ,,,,,,,,,,,,,13,,,,,,,,,,,,,7,,,,,,,,,,,,,13,,,,,,,,,,,,,,,,,,,,,,,,,,,14,15,,,,,20,21,,,,,,,,,,,,,,,,,,99,,,,,,,,,,,,,,,,,,,,,,,,,,,,,,,,,,,,,,,,,,,,,,,,,,,,,,,,,,,,,,,,,,,,,,,,,,,,,,,,,,,,,,,,,,,,,,,,,,,,,,,,,,,,,,,,,,99,2,,1,,2,,6,3,,,,,,98,A5,,,,,,,,,2,,,,,,,,,,,,,,,,,,,,,,,,,,,,99,3,,3,2,99,2,64
125592427,1,1,7,45,1,1,1,10,Fast processing speed  when using the smartphone and long-used battery.,10,Fast processing speed  when using the smartphone and long-used battery. Nice appearance and  body  shape design with beautiful body color.,,,,,,,,,,,,,,,,,,,,,,,,,It was damaged,7,,,,,,,,,,,,,,,,,,,,,21,,,,,,1,,,,,6,,,,,,,,,,,,,,20,,,,,,,,,,,,,,,,,,,99,,,,,,,,,,,,,,,,,,,,,,,,,,,,,,,,,,,,,,,,,,,,,,,,,,,,,,,,,,,,,,,,,,,,,,,,,,,,,,,,,,,,,,,,,,,,,,,,,,,,,,,,,,,,,,,,,,99,5,,3,,2,,4,3,,,,,,98,A53,,,,,,,,,6,,,,,,,,,,,,,,,,,,,,,,,,,,,Bigger font size,,98,General labour,4,2,3,2,18
125592549,1,2,6,40,1,1,1,5,Has a nice appearance and body design with beautiful body color. But there is no stabilization mode for rear cameras. The screen display colors are not vivid enough.,7,Has a nice appearance and body design with beautiful body color. But there is no stabilization mode for rear cameras. The screen display colors are not vivid enough. I feel the price of this model is high when comparing  with the specifications given.,,,,,,,,,,,,,,,,,,,,,,,,,It was damaged,7,,,,,,,,,,,,12,,,,,,,,,,,,,,,1,2,3,,,,,,,,,,,,,,,,,,,,,,,,,,,,,,,,,,,,99,,,,,,,,,,,,,,,,,,,,,,,,,,,,,,,,,,,,,,,,,,,,,,,,,,,,,,,,,,,,,,,,,,,,,,,,,,,,,,,,,,,,,,,,,,,,,,,,,,,,,,,,,,,,,,,,,,99,3,,1,,1,3,6,3,,,,,,10,,,,,,,,,,5,,,,,,,,,,,,,,,,,,,,20,,,,,,,The cameras should not be water drop design,,10,,5,2,2,2,22
125592742,1,2,6,42,1,1,1,9,"Front camera take clear, sharp and beautiful photos. And has high capacity.",8,"Front camera take clear, sharp and beautiful photos. And has high capacity. Has a nice appearance and body shape design with light weight.",,,,4,,,,,,,,,13,,,,,,,,,,,,,7,,,,,,,,,,,,,,,15,,,,,,,,,,,,1,,,,,,7,,,,,,,,15,,,,,,,,,,,,,,,,,,,,,,,,99,,,,,,,,,,,,,,,,,,,,,,,,,,,,,,,,,,,,,,,,,,,,,,,,,,,,,,,,,,,,,,,,,,,,,,,,,,,,,,,,,,,,,,,,,,,,,,,,,,,,,,,,,,,,,,,,,,99,5,,3,,2,,5,5,,,,,,,,,,99,,,,,,7,,,,,,,,,,,,,,,,,,,,,,,,,,,,99,9,,3,3,4,2,21
125592809,1,2,5,36,1,1,1,8,High capacity offered by this model and front camera takes beautiful and clear photos.,9,High capacity offered by this model and front camera takes beautiful and clear photos. Durable battery comes up with fast charging speed.,,,,,,,,,,,,,,,,,,,,,,,,,It was damaged,7,,,,,,,,,,,,12,,,,,,,,,,,,,,,,,,,,,7,,,,,,,,15,,,,,20,21,,,,,2,,,5,,,,,,,,,,,,,,,,,,,,,,,,,,,,,,,,99,,,,,,,,,,,,,,,,,,,,,,,,,,,,,,99,,,,,,,,,,,,,,,,,1,,,4,,,,,,,,,,,,,,,,,,,6,7,,,,,,,,,,4,,6,,,,,,,,,,,5,,1,,2,,6,2,,,,99,,,,,,,,,,,,10,,,,,,,,,,,,,,,,16,,,,,,22,23,,,,,,2,,5,2,2,2,63
125592841,1,2,7,49,1,2,1,9,"Has a nice appearance and body shape design with beautiful rear cover color. Rear cameras take vivid-colored, beautiful and clear photos.",9,Affordable price and there is a promotion that I could buy this model in low price.,,,,,,,,,,,,,,,,,,,,,,,,,It was damaged,6,,,,,,,,,,,,12,,,,,,,,,,,,,,,1,,,,,,,,,,,,,14,15,,,,,,,,,,,,,,,,,,,,,,,,99,,,,,,,,,,,,,,,,,,,,,,,,,,,,,,,,,,,,,,,,,,,,,,,,,,,,,,,,,,,,,,,,,,,,,,,,,,,,,,,,,,,,,,,,,,,,,,,,,,,,,,,,,,,,,,,,14,,,7,,4,,2,,5,6,,,,,,,,,,,,99,,,,4,,,,,,,,,,,,,,,,,,,,,,,,,,,,99,10,,3,2,99,2,29
125592912,1,2,5,35,1,1,1,10,Fast processing speed and smooth and good flow touchscreen.,10,Fast processing speed and smooth and good flow touchscreen. Has a nice body shape design with wide screen display size.,,,,,,,,,,,,,13,,,,,,,,,,,,,7,,,,,,,,,,,,12,,,,,,,,,,,,,,,1,,,,,6,7,,,,11,,,,,,,,,,,,,,,2,,,,,,,,,,,,,,,,,,,,,,,,,,,,,,,,,,,99,,,,,,,,,,,,,,,,,,,,,,,,,,,,,,,,,,,,,,,,,,,,,,,,,,,,,,,9,,,,,,,,,,,,,,,,,,,,,,,,,,,,,,,,,,,14,,,3,,1,,2,,6,2,,,,99,,,,,,,,,,,,5,,,,,,,,,,,,,,,,,,,,,,,,,,,,99,12,,3,1,1,2,6
125592945,1,2,3,26,1,1,1,10,Front camera takes beautiful selfie photos and bright colors and clear when shooting at night time.  Has a nice appearance design.,9,"High specifications e.g., big ROM and RAM capacity. High capacity allows to store many photos, videos and other files inside the device. But I do not like the popped up ads and notifications which mainly encourage to download games. ",,,,,,,,,,,,,,,,,,,,,,,,,It was dropped into the water,7,,,,,,6,,,,,,,,,,,,,,,,,,,,,1,,,,,6,7,,,,,,,,15,,17,,,,,,,,,,,,,,,,,,,,,,99,,,,,,,,,,,,,,,,,,,,,,,,,,,,,,,,,,,,,,,,,,,,,,,,,,,,,,,,,,,,,,,,,,,,,,,,,,,,,,,,,,,,,,,,,,,,,,,,,,,,,,,,,,,,,,,,,,99,3,,1,,1,3,4,2,,,,7,,,,,,,,,,,,7,,,,,,,,,,,,,,,,,,,,,,,,,,26,,,3,,5,2,99,1,
125593009,1,2,7,45,1,2,1,8,"This model offers big memory size, overall good performance when using the device. And wide screen display size which is clearly seen. But there is notification shown up on Line app, so, I have to access through app to check the messages by myself.",8,Overall good performance when using the device and has a big memory size. And durable battery which lasts for a long time with less frequently charges.,,,,,,,,,,,,12,13,,,,,,,,,,,,,99,,,,,,,,,,,,12,,,,,,,,,,,,,,,1,,,,,,7,,,,11,,,,,,,,,,,,,,,,,,5,,,,,,,,,,,,,,,,,,,,,,,,,,,,,,,,,,,,,,,,,,,,,,,,,,,,,2,,,,,,,,,,,,,,,,,,,,,,,,,,,,,,,,,,,,,,,14,,,,,,,,,,,,,,,,,,,,,,,,,,,,,,,,99,7,,4,,2,,6,5,,,,,,,,,,98,Y12,,,,,3,,,,,,,,,,,,,,,,,,,,,,,,,,,,99,11,,2,1,99,2,50
125593043,1,1,6,43,1,1,1,8,"Front and rear cameras take beautiful, clear and refined photos.",8,"Front and rear cameras take beautiful, clear and refined photos. And the cellphone is fast processing speed when using it.",,,,,,,,,,,,,,,,,,,,,,,,,It was damaged,7,,,,,,,,,,,,12,,,,,,,,,,,,,,,1,2,,,,,,,,,,,,14,15,,,,,,,,,,,,,,,,,,,,,,,,99,,,,,,,,,,,,,,,,,,,,,,,,,,,,,,,,,,,,,,,,,,,,,,,,,,,,,,,,,,,,,,,,,,,,,,,,,,,,,,,,,,,,,,,,,,,,,,,,,,,,,,,,,,,,,,,,,,99,10,,1,,2,,6,5,,,,,,,,,,99,,,,,,5,,,,,,,,,,,,,,,15,,,,,,,,,,,,,,6,,3,99,10,2,6
125593077,1,1,4,30,1,1,1,9,The speed of processing is pretty fast. There is no hangs or lags when playing games. Has a cooling system makes the device not heats up when using it for  a long  time. ,9,"The specifications of this model is value for money from big ROM, RAM and CPU capacity offered with reasonable price.",,,,4,,,,,,,,,13,,,,,,,,,,,,,6,,,,,,,,,,,,,,,15,16,,,,,,,,,,,,,,,5,6,7,8,,,,,,,,,,,,,,,,,,2,,,,,,,,,,,,,,,,,,,,,,,,,,,,4,,,,,,,,,,,,,,,,,,,,,,,,,,,,,,,,,,,,,,,,,,,,,,,,,,,,,,,,,4,,,,,,,,,,,,,,,,,,,,,,,,,,,1,,,4,,,,,,,,,,,,,9,,1,,2,,5,2,,,,7,,,,,,,,,,,,7,,,,,,,,,,,,,,,,,,,,,,,,,,,,99,3,,4,3,99,2,36
125593129,1,2,6,40,1,1,1,9,"Has a nice screen display and wide screen size with light weight and easy as well as convenient to carry out. Front and rear cameras take beautiful photos. But there is  limited body color choices  that only 2 colors available. I want orange color but there is not available at the store so, I take black color. Should have many colors to choose.",9,Both cameras take clear and sharp photos. Durable battery with fast charging speed. And the price is not high.,,,,,,,,,,10,,,,,,,,,,,,,,,,7,,,,,,,,,,,,12,,,,,,,,,,,,,,,1,,,,,6,7,,,,,,,,,,,,,,,,,Price is not exceeded the budget,,2,3,,5,,,,,,,,,,,,,,,,,,,,,,,,,4,,,,,,,,,,3,,,,,,,,,,,,,,,,,,,,,,,,,,,99,,,,,,,,,,,,,,,,,,,,4,,,,,9,,,,,,,,,,,,,,,,,,,,,,,,,,,,,,,,,,,,,99,9,,1,,2,,6,2,,,,99,,,,,,,,,,,,5,,2,,,,,,,,,,,,,,,,,,,,,,,,,Should have many body colors to choose around 7-8 choices ,,9,,3,2,99,2,73
125593144,1,2,2,18,1,1,1,9,"Fast charging speed. Front and rear cameras  take beautiful, clear, refined and vivid-colored photos.",8,"Fast charging speed. Front and rear cameras  take beautiful, clear, refined and vivid-colored photos. And fast processing speed when using this model.",,,,,,,,,,,,,13,,,,,,,,,,,,,8,,,,,,,,,,,,,,,,,,,,,21,,,,,,1,,,,,,,,,,,,,14,15,,,,,,21,,,,,,,,,,,,,,,,,,99,,,,,,,,,,,,,,,,,,,,,,,,,,,,,,,,,,,,,,,,,,,,,,,,,,,,,,,,,,,,,,,,,,,,,,,,,,,,,,,,,,,,,,,,,,,,,,,,,,,,,,,,,,,,,,,,,,99,9,,1,,2,,6,3,,,,,,98,A5 (2020),,,,,,,,,3,,,,,,,,,,,,,,,,,,,,,,,,,,,,99,1,,4,99,4,2,6
