125462866,1,1,8,51,1,2,1,8,"Front and rear cameras take clear and sharp photos. But the device slightly lags or slow responses sometimes, besides, when using Line app, it bounces back to the main screen.",8,"This model comes up with the system that easy to use. Front and rear cameras take clear and sharp photos, look realistic.",,,,,,,,,,,,,,,,,,,,,,,,,It was dropped into water,7,,,,,,,,,,,,12,,,,,,,,,,,,,,,1,,,,,6,7,,,,,,,,,,,,,,,,,,,,,,5,,,,,,,,,,,,,,,,,,,,,,,,,,,,,,,,,,,,,,,,,,,,,,,,,,,,,,,,,,,,,,99,,,,,,,,,,,,,,,,,,,,4,,,,,9,,,,,,,,,,,,,,,,,,,,,,,,,,,,,,,,,,,14,,,2,,1,,2,,5,3,,,,,,99,,,,,,,,,,3,,,,,,,,,,,,,,14,15,,,,,,,,,,,,,,2,,5,5,99,2,25
125462911,1,2,8,50,1,1,1,10,Long-used battery with fast charging speed. There are several functions and features available as well as the system is stable makes the device runs smoothly when using it. Front and rear cameras take clear and sharp photos. Has  a large body size and heavy weight.,10,There are several functions and features available as well as the system is stable when using the device. Long-used battery with fast charging speed. Front and rear cameras take clear and sharp photos.,,,,,,,,,,,,,,,,,,,,,,,,,I gave it to my family member,99,,,,,,,,,,,,,13,,,,,,,,,,,,,,,,,,,,,,,,,,,14,15,,,,,20,21,,,,,2,,,,,,,,,,,,,,,,,,,,,,,,,,,,,,,,,,,99,,,,,,,,,,,,,,,,,,,,,,,,,,,,,,,,,,,,,,,,,,,,,,,1,,,,,,,,,,,,,,,,,,,,,,6,7,,,,,,,,,,,,,7,,,,,,,,,,2,,1,,2,,6,6,,,,,,,,,,,,99,,,,4,,,,,,,,,,,,,,,,,,,,,,,,,,,,99,3,,2,2,99,2,29
125462925,1,1,3,25,1,1,1,10,"Front and rear cameras take clear, beautiful and sharp photos with fast charging  speed.",10,"There are many features or functions available and easy to use device. Besides, when listening to the music, there is clear and loud sound.",,,,,,,,,,10,,,,,,,,,,,,,,,,7,,,,,,6,,,,,,12,,,,,,,,,,,,,,,1,,,,,,,,,,,,,14,15,,,,,,,,,,,,,,,,,,,,,,,,99,,,,,,,,,,,,,,,,,,,,,,,,,,,,,,,,,,,,,,,,,,,,,,,,,,,,,,,,,,,,,,,,,,,,,,,,,,,,,,,,,,,,,,,,,,,,,,,,,,,,,,,,,,,,,,,,,,99,9,,3,,2,,5,5,,,,,,,,,,98,Y12,,,,,2,,,,,,,,,,,,,,,,,,,,,,,,,,,,99,10,,3,2,3,2,29
125462983,1,1,5,38,1,2,1,10,Front and rear cameras take clear and sharp photos. And the device runs smoothly when using it.,10,Front and rear cameras take clear and sharp photos. And the device runs smoothly with fast processing speed when using it. Fast charging speed and durable battery. And the system is easy to navigate.,,,,,,,,,,10,,,,,,,,,,,,,,,,6,,,,,,,,,,,,12,,,,,,,,,,,,,,,1,,,,,6,7,,,,,,,14,15,,,,,,,,,,,,,,,,,,,,,,,,99,,,,,,,,,,,,,,,,,,,,,,,,,,,,,,,,,,,,,,,,,,,,,,,,,,,,,,,,,,,,,,,,,,,,,,,,,,,,,,,,,,,,,,,,,,,,,,,,,,,,,,,,,,,,,,,,,,99,2,,3,,2,,5,6,,,,,,,,,,,,99,,,,99,,,,,,,,,,,,,,,,,,,,,,,,,,,,99,10,,2,2,3,2,21
125463055,1,2,4,31,1,1,1,7,"Rear cameras take unclear, pale colors, and slightly dark tone even adjusted light.",7,Smooth and good flow when using the device. But rear cameras take not beautiful colored photos.,,,,,,,,,,,,,13,,,,,,,,,,,,,7,,,,,,,,,,,,12,,,,,,,,,,,,,,,1,2,,,,,,,,,,,,14,15,,,,,,,,,,,2,,,,,,,,,,,,,,,,,,,,,,,,,,,,,,,,,,,99,,,,,,,,,,,,,,,,,,,,,,,,,,,,,,,,,,,,,,,,,,,,,,,1,,,,,,,,,,,,,,,,,,,,4,5,,,,,,,,,1,,,,,,,,,,,,,,,,9,,3,,1,3,6,3,,,,,,99,,,,,,,,,,5,,,,,,,,,,,,,,,,16,17,,,,,,,,,,,,6,,6,3,9,1,
125463106,1,1,4,31,1,1,1,9,"Fast processing, smooth and good flow when using the device. And has a big memory size and high capacity.",10,"Fast processing, smooth and good flow when using the device. And has a big memory size and high capacity.  But rear cameras take unclear and blurry photos.",1,2,,,,,,,,,,,,,,,,,,,,,,,,7,,,,,,,,,,,,12,,,,,,,,,,,,,,,,,,,,6,7,,,,,,,,,,,,,,,,,,,,,,,,,,,,,,,,99,,,,,,,,,,,,,,,,,,,,,,,,,,,,,,,,,,,,,,,,,,,,,,,,,,,,,,,,,,,,,,,,,,,,,,,,,,,,,,,,,,,,,,,,,,,,,,,,,,,,,,,,,,,,,,,,,,99,2,,1,,2,,6,3,,,,,,98,A15,,,,,,,,,3,,,,,,,,,,,,,,14,15,16,17,,,,,,,,,,,,2,,3,3,2,2,9
125463107,1,1,3,25,1,1,1,10,Nice appearance design with beautiful cover color. Smooth and responsive touchscreen. High definition screen display and has a large screen size. Fast charging  speed and durable battery.,8,Nice appearance design. High definition screen display and has a large screen size. Smooth and responsive touchscreen.  Fast charging  speed and durable battery.,,,,,,,,,,,,,,,,,,,,,,,,,I gave it to my family member,7,,,,,,,,,,,,12,,,,,,,,,,,,,,,1,2,,,,6,7,,,,,,,,,,,,,20,21,,,,,,,,,,,,,,,,,,99,,,,,,,,,,,,,,,,,,,,,,,,,,,,,,,,,,,,,,,,,,,,,,,,,,,,,,,,,,,,,,,,,,,,,,,,,,,,,,,,,,,,,,,,,,,,,,,,,,,,,,,,,,,,,,,,,,99,3,,1,,2,,6,2,,,,99,,,,,,,,,,,,99,,,,,,,,,,,,,,,,,,,,,,,,,,,,99,1,,5,1,99,2,6
125463147,1,2,8,50,1,1,1,10,Has a nice body color and this is the latest model that offers high capacity.,10,This model offers expandable RAM capacity and long-used battery.,,,,,,,,,,,,,,,,,,,,,,,,,It was damaged,99,,,,,,,,,,,,12,,,,,,,,,,,,,,,,2,,,,6,7,,,,,,,,,,,,,,,,,,,,,,,,,,,,,,,,99,,,,,,,,,,,,,,,,,,,,,,,,,,,,,,,,,,,,,,,,,,,,,,,,,,,,,,,,,,,,,,,,,,,,,,,,,,,,,,,,,,,,,,,,,,,,,,,,,,,,,,,,,,,,,,,,,,99,2,,1,,2,,6,6,,,,,,,,,,,,99,,,,4,,,,,,,,,,,,,,,,,,,,,,,,,,,,99,10,,3,2,99,2,21
125463154,1,1,99,,1,1,1,8,"Long-used battery. Front and rear cameras take clear and sharp photos. However, there is a problem that when I delete the data from SD card, all of the photos are deleted as well.",8,Fast processing speed when using the smartphone. Front and rear cameras take beautiful photos.,1,,,,,,,,,,,,13,,,,,,,,,,,,,7,,,,,,,,,,,,12,,,,,,,,,,,,,,,,,,,,6,7,,,,,,,,,,,,,,,,,,,,,,,,,,,,,,,,99,,,,,,,,,,,,,,,,,,,,,,,,,,,,,,,,,,,,,,,,,,,,,,,,,,,,,,,,,,,,,,,,,,,,,,,,,,,,,,,,,,,,,,,,,,,,,,,,,,,,,,,,,,,,,,,,,,99,5,,1,,2,,6,6,,,,,,,,,,,,99,,,,2,,,,,,,,,,,,,,,,,,,,,,,,,,,,99,10,,2,1,99,2,28
125463192,1,1,6,41,1,1,1,8,The device is easy and simple to use or navigate and has a large screen display size.,8,High capacity and has a nice  appearance with rectangular body design.,,,,,,,,,,,,,,,,,,,,,,22,,,,7,,,,,,,,,,,,12,,,,,,,,,,,,,,,,2,,,,,,,,,,,,,,,,,,20,,,,,,,,,5,,,,,,,,,,,,,,,,,,,,,,,,,,,,,,,,,,,,,,,,,,,,,,,,,,,,,,,,,,,,,,99,,,,,,,,,,,,,,,,,,,,,,,,,,,,,,,,I want to try OPPO ,,,,,,,,,,,,,,,,,,,,,,,,,,,,,,99,7,,4,,2,,6,5,,,,,,,,,,99,,,,,,3,,,,,,,,,,,,,,,,,,,,,,,,,,,,99,9,,3,3,99,2,24
125463237,1,2,2,24,1,1,1,8,Long-used battery but there is an issue with unstable WIFI signal connection (TOT).,8,Front and rear cameras take beautiful and vivid-colored photos.,1,2,,,,,,,,,,,13,,,,,,,,,,,,,9,,,,,,,,,,,,12,,,,,,,,,,,,,,,,,,,,6,7,,,,,,,14,15,,,,,,,,,,,,3,,,,,,,,,,,,,,,,,,,,,,,,,,,,,,,,,,,1,,,,,,,,,,,,,,,,,,,,,,,,,,,,,,,,,,,,,,,,,,,,,,1,,,,,,,,,,,,,,,,,,,,,,6,7,,,,,,,,,,,,,,,,,,,,14,,,2,,1,,2,,5,3,,,,,,99,,,,,,,,,,99,,,,,,,,,,,,,,,,,,,,,,,,,,,,99,3,,4,3,6,2,6
125463245,1,1,1,16,1,2,1,10,"This mobile phone has large storage space which is able to keep much data. Besides, the device performs fast or rapidly when using it. ",10,Not expensive price. There is no lags or hangs when using the smartphone.,,,,,,,,,,10,,,,,,,,,,,,,,,,2,,,,,,,,,,,11,,,,,,,,,,,,,,,,,2,,,,6,7,,,,,,,,,,,,,,,,,,,,,,,,,,,,,,,,99,,,,,,,,,,,,,,,,,,,,,,,,,,,,,,,,,,,,,,,,,,,,,,,,,,,,,,,,,,,,,,,,,,,,,,,,,,,,,,,,,,,,,,,,,,,,,,,,,,,,,,,,,,,,,,,,,,99,9,,1,,1,3,4,5,,,,,,,,,,98,Y91,,,,,4,,,,,,,,,,,,,,,,,,,,,,,,,,,,99,9,,3,1,1,2,41
125463290,1,1,7,47,1,1,1,10,"The smartphone offers good operating system makes the device fast processing when using it. Moreover, front and rear cameras take clear and sharp photos, no need to adjust or retouch them.",10,I like rear cover color with the metal material at the side edge of the  device.,,,,,,,,,,10,,,,,,,,,,,,,,,,4,,,,,,,,,,,,12,,,,,,,,,,,,,,,1,,,4,,,,,,,,,,,,,,,,,,,,,,,,,,,,,,,,,,,99,,,,,,,,,,,,,,,,,,,,,,,,,,,,,,,,,,,,,,,,,,,,,,,,,,,,,,,,,,,,,,,,,,,,,,,,,,,,,,,,,,,,,,,,,,,,,,,,,,,,,,,,,,,,,,,,,,99,2,,3,,2,,5,7,,,,,,,,,,,,,,4,,5,,,,,,,,,,,,,,,,,,,,,,,,,,,,99,3,,5,3,7,1,
125463295,1,2,9,62,1,1,1,8,Has a large screen display size.  Front and rear cameras take beautiful and vivid-colored photos.,10,The smartphone has a good performance in overall. Front and rear cameras take beautiful and vivid-colored photos.,,,,,,,,,,10,,,,,,,,,,,,,,,,7,,,,,,,,,,,,12,,,,,,,,,,,,,,,,,,,,,,,,,,,,14,15,,,,,,,,,,,,,,,,,,,,,,,,99,,,,,,,,,,,,,,,,,,,,,,,,,,,,,,,,,,,,,,,,,,,,,,,,,,,,,,,,,,,,,,,,,,,,,,,,,,,,,,,,,,,,,,,,,,,,,,,,,,,,,,,,,,,,,,,,,,99,5,,1,,2,,6,3,,,,,,99,,,,,,,,,,3,,,,,,,,,,,,,,,,,,,,,,,,,,,,99,9,,2,3,2,2,39
125463344,1,2,6,43,1,1,1,10,Nice appearance and body design.Fast processing speed and easy to use functions and apps. Fast charging speed and long-used battery. High capacity as well as big ROM and RAM capacity.,9,High capacity as well as big ROM and RAM capacity. Nice appearance and body design.Fast processing speed and easy to use functions and apps. Fast charging speed and long-used battery. ,,,,4,,,,,,,,,,,,,,,,,,,,,,6,1,,,,,,,,,,11,,,,,,,,,,,,,,,,1,,,,,6,7,,,,,,,14,15,,,,,,,,,,,,,,5,,,,,,,,,,,,,,,,,,,,,,,,,,,,,,,,,,,,,,,,,,,,,,,,,,,,,,,,,,,,,,99,,,,,,,,,,,,,,,,,,,,,,,,,9,,,,,,,,,,,,,,,,,,,,,,1,,,,,,,,,,,,,,,,3,,3,,2,,6,5,,,,,,,,,,98,V7+,,,,,9,,,,,,,,,,,,,,14,15,16,17,,,,,,,,,,,,2,,6,99,99,2,69
125463346,1,2,2,20,1,1,1,10,Smooth and good flow when using this smartphone. There is a nice rear cover color and modern and beautiful appearance design.,10,Has a large screen display size. And big ROM and RAM capacity with not expensive price.,,,,,,,,,,,,,,,,,,,,,,,,,It was damaged,6,,,,,,,,,,,,12,,,,,,,,,,,,,,,1,2,,,,,,,,,,,,,,,,,,,,,,,,,,,,,,,,,,,,,99,,,,,,,,,,,,,,,,,,,,,,,,,,,,,,,,,,,,,,,,,,,,,,,,,,,,,,,,,,,,,,,,,,,,,,,,,,,,,,,,,,,,,,,,,,,,,,,,,,,,,,,,,,,,,,,,,,99,3,,1,,1,3,5,5,,,,,,,,,,98,Y20,,,,,99,,,,,,,,,,,,,,,,,,,,,,,,,,,,99,3,,4,2,1,2,23
125463349,1,2,4,33,1,1,1,10,Fast and responsive touchscreen. The smartphone is fast processing when using it.,10,Fast and responsive touchscreen. The smartphone is fast processing when using it. Has a properly large screen display size.,,,,,,,,,,,,,,,,,,,,,,,,,It was damaged,6,,,,,,,,,,,,,,,,,,,,,,,,,25,,1,,,,,6,7,,,,,,,,,,,,,,,,,,,,,,,6,,,,,,,,,,,,,,,,,,,,,,,,,,,,,,,,,,,,,,,,,,,,,,,,,,,,,,,,,,,,,,,,,,,,,99,,,,,,,,,,,,4,,,,,,,,,,,,,,,,,,,,,,,,,,,1,,,,,,,,,,,,,14,,,5,,3,,1,1,5,3,,,,,,99,,,,,,,,,,99,,,,,,,,,,,,,,,,,,,,,,,,,,,,99,2,,3,2,3,2,3
125463390,1,1,2,20,1,2,1,10,There are variety of functions available to use. Front and rear cameras take clear and sharp photos.,10,There are variety of functions available to use. And has a nice appearance and body design. Front and rear cameras take clear and sharp photos.,,,,,,,,,,,,,13,,,,,,,,,,,,,6,,,,,,,,,,,,12,,,,,,,,,,,,,,,1,,,,,6,7,,,,,,,,,,,,,,,,,,,,,,,,,,,,,,,,99,,,,,,,,,,,,,,,,,,,,,,,,,,,,,,,,,,,,,,,,,,,,,,,,,,,,,,,,,,,,,,,,,,,,,,,,,,,,,,,,,,,,,,,,,,,,,,,,,,,,,,,,,,,,,,,,,,99,2,,1,,2,,6,3,,,,,,98,A53,,,,,,,,,2,,,,,,,,,,,,,,,,,,,,,,,,,,,,99,10,,2,1,99,1,
125463426,1,1,99,,1,1,1,8,This model is able to expand RAM capacity and the refresh rate of the screen display is also adjustable.,8,There is clear and loud sound when listening to the music on several clips.,,,,,,,,,,,,,,,,,,,,,,,,,It was damaged,7,,,,,,,,,,,,12,,,,,,,,,,,,,,,,,,,,6,7,8,9,,,,,,,,,,,,,,,,,,,,,,,,,,,,,,99,,,,,,,,,,,,,,,,,,,,,,,,,,,,,,,,,,,,,,,,,,,,,,,,,,,,,,,,,,,,,,,,,,,,,,,,,,,,,,,,,,,,,,,,,,,,,,,,,,,,,,,,,,,,,,,,,,99,5,,1,,2,,6,5,,,,,,,,,,99,,,,,,9,,,,,,,,8,,,,,,,,,,,,,,,,,,,,,12,,99,99,99,1,
125463457,1,1,4,30,1,1,1,8,High capacity and big memory size with fast charging speed offered.,8,"Fast processing, smooth and good flow when using the device and has a proper body size. As well as high capacity and big memory size with fast charging speed offered.",,,,,,,,,,10,,,,,,,,,,,,,,,,3,,,,,,,,,,,,12,,,,,,,,,,,,,,,1,,,,5,6,7,8,,,,,,,,,,,,,,,,,,,,,,,,,,,,,,,99,,,,,,,,,,,,,,,,,,,,,,,,,,,,,,,,,,,,,,,,,,,,,,,,,,,,,,,,,,,,,,,,,,,,,,,,,,,,,,,,,,,,,,,,,,,,,,,,,,,,,,,,,,,,,,,,,,99,2,,1,,2,,6,98,Tecno Spark,,,,,,,,,,,,,,,1,,,,,,,,,,,,,,,,,,,,,,,,,,,,99,10,,3,2,99,2,13
125463471,1,1,5,35,1,1,1,9,Fast processing speed. The cameras take beautiful photos as well as both front and rear cameras take clear and sharp photos. Speedy responses including fast and responsive touchscreen.,10,"Front and rear cameras take clear and sharp photos. Fast processing  speed, peedy responses including fast and responsive touchscreen.",,,,,,,,,,,,,13,,,,,,,,,,,,,7,,,,,,,,,,,,,,,15,,,,,,,,,,,,1,,,,,6,7,,,,,,,14,15,,,,,,,,,,,,,,,,,,,,,,,,99,,,,,,,,,,,,,,,,,,,,,,,,,,,,,,,,,,,,,,,,,,,,,,,,,,,,,,,,,,,,,,,,,,,,,,,,,,,,,,,,,,,,,,,,,,,,,,,,,,,,,,,,,,,,,,,,,,99,3,,1,,2,,6,2,,,,98,J4+,,,,,,,,,,,3,,,,,,,,,,,,,,,,,,,,,,,,,,,,99,2,,4,99,99,2,73
125463475,1,1,6,42,1,1,1,9,The smartphone has a nice rear cover color and fast processing speed of the CPU. ,9,Has a big memory size with the internet connecting to HG4.,,,,,,,,,,,,,,,,,,,,,,,,,It was damaged,4,,,,,,,,,,,,12,,,,,,,,,,,,,,,,,,4,,6,7,,,,,,,,,,,,,,,,,,,,,,,,,,,,,,,,99,,,,,,,,,,,,,,,,,,,,,,,,,,,,,,,,,,,,,,,,,,,,,,,,,,,,,,,,,,,,,,,,,,,,,,,,,,,,,,,,,,,,,,,,,,,,,,,,,,,,,,,,,,,,,,,,,,99,2,,1,,2,,6,2,,,,8,,,,,,,,,,,,99,,,,,,,,,,,,,,,,,,,,,,,,,,,,99,99,,99,99,99,2,23
125463492,1,2,4,33,1,1,1,10,Has a nice slim body shape design and smooth and good flow when using the device.,10,Has a nice appearance and body shape design and not expensive price.,,,,,,,,,,,,,13,,,,,,,,,,,,,7,,,,,,6,,,,,,12,,,,,,,,,,,,,,,1,,,,,,,,,,,,,,,,,,,,,,,,,,,,,,,,,,,,,,99,,,,,,,,,,,,,,,,,,,,,,,,,,,,,,,,,,,,,,,,,,,,,,,,,,,,,,,,,,,,,,,,,,,,,,,,,,,,,,,,,,,,,,,,,,,,,,,,,,,,,,,,,,,,,,,,,,99,5,,1,,2,,3,3,,,,,,98,A5 (2020),,,,,,,,,3,,,,,,,,,,,,,,,,,,,,,,,,,,,,99,3,,3,3,2,2,24
125463542,1,1,3,25,1,1,1,10,Both front and rear cameras take beautiful photos. And the device performs fast processing and speedy reponses.,9,The device performs fast processing and speedy reponses. And this model is easy to use or navigate.,,,,,,,,,,,,,13,,,,,,,,,,,,,7,,,,,,,,,,,,12,,,,,,,,,,,,,,,,,,,,6,7,8,,,,,,,,,,,,,,,,,,,,,,,,,,,,,,,99,,,,,,,,,,,,,,,,,,,,,,,,,,,,,,,,,,,,,,,,,,,,,,,,,,,,,,,,,,,,,,,,,,,,,,,,,,,,,,,,,,,,,,,,,,,,,,,,,,,,,,,,,,,,,,,,,,99,5,,1,,2,,5,5,,,,,,,,,,98,Y19,,,,,4,,,,,,,,,,,,,,,,16,17,,,,,,,,,,,,10,,4,2,2,2,21
125463555,1,2,8,51,1,1,1,9,"Front and rear cameras take clear, sharp and vivid-colored  photos.",9,The cellphone is easy to navigate and use with fast charging  battery.,,,,,,,,,,,,,13,,,,,,,,,,,,,7,,,,,,,,,,,,12,,,,,,,,,,,,,,,,,,,,,,,,,,,,14,15,,,,,,21,,,,,,,,,,,,,,,,,,99,,,,,,,,,,,,,,,,,,,,,,,,,,,,,,,,,,,,,,,,,,,,,,,,,,,,,,,,,,,,,,,,,,,,,,,,,,,,,,,,,,,,,,,,,,,,,,,,,,,,,,,,,,,,,,,,,,99,2,,3,,2,,6,3,,,,,,8,,,,,,,,,,99,,,,,,,,,,,,,,,,,,,,,,,,,,,,99,11,,3,99,99,2,75
125463596,1,2,6,40,1,1,1,9,This smartphone has a good perfromance in overall without any problem found.,9,The device runs smoothly and good flow when using it without any problem found.,,,,,,,,,,,,,13,,,,,,,,,,,,,5,,,,,,,,,,,,12,,,,,,,,,,,,,,,,,,,,6,7,,,,,,,,,,,,,,,,,,,,,,,,,,,,,,,,99,,,,,,,,,,,,,,,,,,,,,,,,,,,,,,,,,,,,,,,,,,,,,,,,,,,,,,,,,,,,,,,,,,,,,,,,,,,,,,,,,,,,,,,,,,,,,,,,,,,,,,,,,,,,,,,,,,99,5,,1,,2,,6,5,,,,,,,,,,98,V5,,,,,6,,,,,,,,,,,,,,,,,,,,,,,,,,,,99,11,,3,99,2,2,48
125463603,1,1,5,37,1,1,1,10,"Fast processing speed, smooth and good flow when using the device. High capacity and big memory size.",10,"The system of this model is easy and not complicated to use and fast  processing speed, no hangs or lags.",,,,,,,,,,,,,,,,,,,,,,,,,I gave it to my family member,99,,,,,,,,,,,,12,,,,,,,,,,,,,,,1,2,,,,6,7,8,,,,,,,,,,,,,,,,,,,,,,,,,,,,,,,99,,,,,,,,,,,,,,,,,,,,,,,,,,,,,,,,,,,,,,,,,,,,,,,,,,,,,,,,,,,,,,,,,,,,,,,,,,,,,,,,,,,,,,,,,,,,,,,,,,,,,,,,,,,,,,,,,,99,2,,1,,2,,1,3,,,,,,98,A57,,,,,,,,,4,,,,,,,,,,,,,,14,,,,,,,,,,,,,,,10,,2,99,99,2,12
125463630,1,1,9,70,1,1,1,8,The system of this model seems to be difficult to use.,7,The system of this model seems to be difficult to use.,,,,4,,,,,,,,,,,,,,,,,,,,,Bloated  battery,7,,,,,,,,,9,,,12,,,,,,,,,,,,,,,1,,,,,,,,,,,,,,,,,,,,,,,,,,,,,,,,,,,,,,99,,,,,,,,,,,,,,,,,,,,,,,,,,,,,,,,,,,,,,,,,,,,,,,,,,,,,,,,,,,,,,,,,,,,,,,,,,,,,,,,,,,,,,,,,,,,,,,,,,,,,,,,,,,,,,,,,,99,5,,1,,2,,6,3,,,,,,99,,,,,,,,,,7,,,,,,,,,,,,,,,,,,,,,,,,,,,,99,12,,4,99,8,2,24
125463641,1,2,9,73,1,1,1,9,Fast and responsive touchscreen with large screen display size.,9,"Long-used battery which is able to last for a long time and when charging battery, there is a notification to inform the timing when the battery will be full of energy.  ",1,2,,4,,,,,,,,,13,,,,,,,,,,,,,7,,,,,,,,,,,,12,,,,,,,,,,,,,,,,,,,,,,,,,11,,,,,,,,,20,,,,,,,,,,,,,,,,,,,99,,,,,,,,,,,,,,,,,,,,,,,,,,,,,,,,,,,,,,,,,,,,,,,,,,,,,,,,,,,,,,,,,,,,,,,,,,,,,,,,,,,,,,,,,,,,,,,,,,,,,,,,,,,,,,,,,,99,7,,3,,2,,6,3,,,,,,99,,,,,,,,,,99,,,,,,,,,,,,,,,,,,,,,,,,,,,,99,12,,99,99,99,2,14
125463712,1,1,3,28,1,1,1,9,"The system allows the device to perform fast and responsive. Fast touchscreen. And the dual speakers provides clear and loud sound. Besides, there is a function that is able to minimize the screen when watching YouTube in order to do other activities at the same time.",9,Speedy responses and easy to use device.,,,,,,,7,,,,,,,,,,,,,,,,,,,7,,,,,,,,,,,,,,,,,,,,,21,,,,,,,,,,,6,7,,,,,,,,,,,,,,,,,,,,,,5,,,,,,,,,,,,,,,,,,,,,,,,,,,,,,,,,,,,,,,,,,,,,,,,,,,,,,,,,,,,,,99,,,,,,,,,,,,,,,,,,2,,,,,,,,,,,,,,,,,,,,,,,,,,,,,,,,,,,,,,,,,,14,,,5,,1,,1,2,6,3,,,,,,8,,,,,,,,,,9,,,,,,,,,,,,,,14,15,16,17,,,,,,,,,,,,2,,4,2,3,2,24
125463722,1,2,5,38,1,2,1,10,Smooth and good flow when using the mobile phone. As well as front and rear cameras take clear and sharp photos.,10,Smooth and good flow when using the mobile phone. As well as front and rear cameras take clear and sharp photos. Fast charging speed.,,,,,,,,,,10,,,,,,,,,,,,,,,,7,,,,,,,,,,,,,13,,,,,,,,21,,,,,,,,,,,6,7,8,,,,,,,,,,,,,21,,,,,,,,,,,,,,,,,,99,,,,,,,,,,,,,,,,,,,,,,,,,,,,,,,,,,,,,,,,,,,,,,,,,,,,,,,,,,,,,,,,,,,,,,,,,,,,,,,,,,,,,,,,,,,,,,,,,,,,,,,,,,,,,,,,,,99,3,,3,,2,,6,2,,,,7,,,,,,,,,,,,99,,,,,,,,,,,,,,,,,,,,,,,,,,,,99,11,,5,99,99,2,14
125463833,1,1,3,28,1,1,1,9,"Fast processing, smooth and good flow when playing games.",10,"Fast processing, smooth and good flow when playing games. And fast charging speed with durable battery.",,,,,,,,,,,,,13,,,,,,,,,,,,,7,,,,,,,,,,,,12,,,,,,,,,,,,,,,1,,,,5,6,7,8,,,,,,,,,,,,,,,,,,,,,,,,,,,,,,,99,,,,,,,,,,,,,,,,,,,,,,,,,,,,,,,,,,,,,,,,,,,,,,,,,,,,,,,,,,,,,,,,,,,,,,,,,,,,,,,,,,,,,,,,,,,,,,,,,,,,,,,,,,,,,,,,,,99,5,,3,,2,,6,3,,,,,,7,,,,,,,,,,6,,,,,,,,,,,11,12,,14,15,,,,,,,,,,,,,,3,,4,2,2,2,53
125463851,1,1,7,48,1,1,1,8,The system is unable to update to colorOS13 makes the screen display slightly lag like slow processing when touching it.,8,The quality of the smartphone matches with the price.,,,,,,,,,,,,,,,,,,,,,,22,,,,11,,,,,,,,,,,,,,,,,,18,,,,,,,,,1,,,,,6,7,,,,,,,,,,,,,,,,,,,2,,,5,,,,,,,,,,,,,,,,,,,,,,,,,,,,,,,,99,,,,,,,,,,,,,,,,,,,,,,,,,,,,,,99,,,,,,,,,,,,,,,,,,,,,,,,,,,,,,,,I like fast charging speed of OPPO,,,,,,,,,,,,,,,1,,,,,,,,,,,,,,,,5,,1,,1,3,3,1,,98,iPhone 13 Pro Max,,,,,,,,,,,,,14,,,,,,,,,,,,,,14,15,16,17,,,,,,,,,,,,9,,6,2,3,2,76
125463878,1,2,9,57,1,1,1,10,Fast processing speed when using the device as well as accessing through apps. Front and rear cameras take clear and sharp photos. Fast charging battery.,10,Fast processing speed when using the device. Fast charging battery. Front and rear cameras take clear and sharp photos. ,,,,4,,,,,,,,,13,,,,,,,,,,,,,8,,,,,,,,,,,,12,,,,,,,,,,,,,,,1,,,,,,,,,,,,,14,15,,,,,,,,,,,2,,,,,,,,,,,,,,,,,,,,,,,,,,,,,,,,,,,99,,,,,,,,,,,,,,,,,,,,,,,,,,,,,,,,,,,,,,,,,,,,,,,,,,4,,,,,,,,,,,,,,,,,,,,,,,,,,,,,,,,,,,,,,,,14,,,3,,3,,1,2,6,3,,,,,,99,,,,,,,,,,9,,,,,,,,,,,,,,,,,,,,,,,,,,,,99,3,,4,2,99,2,3
125463940,1,1,4,31,1,1,1,10,"Fast processing speed, clear and loud sound from speaker. Fast processing speed. High capacity and big memory size.",10,"Fast processing speed, clear and loud sound from speaker. Fast processing speed. High capacity and big memory size.",,,,,,,,,,10,,,,,,,,,,,,,,,,7,,,,,,,,,,,,12,,,,,,,,,,,,,,,1,,,,,6,7,8,,,,,,,,,,,,,,,,,,,,,,,,,,,,,,,99,,,,,,,,,,,,,,,,,,,,,,,,,,,,,,,,,,,,,,,,,,,,,,,,,,,,,,,,,,,,,,,,,,,,,,,,,,,,,,,,,,,,,,,,,,,,,,,,,,,,,,,,,,,,,,,,,,99,2,,98,Pay installment with the store,2,,6,3,,,,,,98,Reno2,,,,,,,,,8,,,,,,,,,,,,,,,,16,17,,,,,,,,,,,,10,,3,3,99,2,53
125464046,1,1,2,23,1,1,1,10,The smartphone is easy and convenient to use with its fast processing speed. And the program inside the device is also easy to use or navigate.,10,Front and rear cameras take beautiful photos and easy to use system.,,,,,,,,,,,,,,,,,,,,,,,,,I gave it to my younger sibling,6,,,,,,,,,,,,,13,,,,,,,,,,,,,,1,2,,,,,,,,,,,,14,15,,,,,,,,,,,,,,,,,,,,,,,,99,,,,,,,,,,,,,,,,,,,,,,,,,,,,,,,,,,,,,,,,,,,,,,,,,,,,,,,,,,,,,,,,,,,,,,,,,,,,,,,,,,,,,,,,,,,,,,,,,,,,,,,,,,,,,,,,,,99,9,,1,,2,,4,3,,,,,,98,A5,,,,,,,,,5,,,,,,,,,,,,,,,,16,17,,,,,,,,,,,,10,,4,2,2,2,21
125464072,1,1,3,26,1,1,1,8,Rear cameras take clear and sharp photos. And fast processing speed when using the device.,8,"Rear cameras take clear, sharp and beautiful colored photos, look realistic. And fast processing speed when using the device.",,,,,,,,,,,,,,,,,,,,,,,,,It was damaged,5,,,,,,,,,,,,12,,,,,,,,,,,,,,,1,2,,,,6,7,8,,,,,,,,,,,,,,,,,,,,,,6,7,,,,,,,,,,,,,,,,,,,,,,,,,,,,,,,,,,,,,,,,,,,,,,,,,,,,,,,,,,,,,,,,,,,,99,,,,,,,,99,,,,4,,,,,9,,,,,,,,,,,,,,,,,,,,,,,,,,,,,,,,,,,14,,,2,,1,,2,,4,4,,,,,,,,98,Mi 10,,,,,,,9,,,,,,,,,,,,,,,,,,,,,,,,,,,,99,9,,2,99,99,1,
125464107,1,1,4,33,1,1,1,10,"Fast processing speed when using the device. Front and rear cameras take clear, sharp and beautiful photos. Has a light body weight and this model looks premium. ",10,Not expensive price. Easy to use or navigate smartphone.,,,,,,,,,,,,,,,,,,,,,,,,,It was damaged,8,,,,,,,,,,,,12,,,,,,,,,,,,,,,1,,,,,,,,,,,,,,,,,,,,,,,,,,,,,,,,,,,,,,99,,,,,,,,,,,,,,,,,,,,,,,,,,,,,,,,,,,,,,,,,,,,,,,,,,,,,,,,,,,,,,,,,,,,,,,,,,,,,,,,,,,,,,,,,,,,,,,,,,,,,,,,,,,,,,,,,,99,5,,1,,1,3,6,3,,,,,,99,,,,,,,,,,10,,,,,,,,,,,,,,,,,,,,,,,,,,,,99,2,,3,2,10,1,
125464125,1,2,1,17,1,1,1,8,Nice appearance design as well as beautiful rear cameras design. Fast and responsive  touchscreen and fast processing speed when using the smartphone.,10,Front and rear cameras take clear and sharp photos. High capacity and big memory size.,1,2,,,,,,,,,,,13,,,,,,,,,,,,,7,,,,,,,,,,,,12,,,,,,,,,,,,,,,1,2,,,,6,7,8,,,,,,14,15,,,,,,,,,,,,,,,,,,,,,,,,99,,,,,,,,,,,,,,,,,,,,,,,,,,,,,,,,,,,,,,,,,,,,,,,,,,,,,,,,,,,,,,,,,,,,,,,,,,,,,,,,,,,,,,,,,,,,,,,,,,,,,,,,,,,,,,,,,,99,2,,1,,2,,6,5,,,,,,,,,,98,Y20,,,,,99,,,,,,,,,,,,,,,,,,,,,,,,,,,,99,1,,4,1,99,2,41
125464185,1,1,8,50,1,2,1,8,Long-used battery with fast charging speed. Rear cameras take clear and sharp photos. There is clear and loud sound  when having telephone conversation.,8, There is clear and loud sound  when having telephone conversation. Long-used battery with fast charging speed. Rear cameras take clear and sharp photos.,,,,,,,,,,,,,13,,,,,,,,,,,,,6,,,,,,,,,,,,12,,,,,,,,,,,,,,,,,,,,,,,,,,,,14,,,,,,20,21,,,,,2,,,,,,,,,,,,,,,,,,,,,,,,,,,,,,,,,,,99,,,,,,,,,,,,,,,,,,,,,,,,,,,,,,,,,,,,,,,,,,,,,,,1,,,,,,,,9,,,,,,,,,,,,,,6,7,,,,,,,,,,,,,,,,,,,,14,,,2,,1,,2,,6,2,,,,98,J7 Prime,,,,,,,,,,,6,,,,,,,,,,,,,,,,,,,,,,,,,,,,99,98,Contractor,2,99,99,2,30
125464187,1,2,2,24,1,1,1,7,The device is slightly lag when using it.,8,This model has a cheap price that suitable for my usage purposes. But there is slightly lag when using the smartphone.,,,,,,,,,,,,,,,,,,,,,,22,,,,7,,,,,,,,,,,11,,,,,,,,,,,,,,,,,,,,,6,7,,,,,,,,,,,,,,,,,,,,,,,,,,,,,,,,99,,,,,,,,,,,,,,,,,,,,,,,,,,,,,,,,,,,,,,,,,,,,,,,,,,,,,,,,,,,,,,,,,,,,,,,,,,,,,,,,,,,,,,,,,,,,,,,,,,,,,,,,,,,,,,,,,,99,5,,3,,2,,6,1,,98,iPhone XR,,,,,,,,,,,,,13,,,,,,,,,,,,,,,,,,,,,,,,,,,Reduce the rear cameras size to be smaller,,9,,5,4,5,1,
125464194,1,2,8,52,1,1,1,10,Smooth and responsive touchscreen. Fast processing speed and long-used battery.,10,"Smooth and responsive touchscreen. Fast processing speed and long-used battery with fast charging speed. Front and rear cameras take clear, sharp and beautiful photos.",,,,,,,,,,,,,13,,,,,,,,,,,,,7,,,,,,,,,,,,,13,,,,,,,,21,,,,25,,1,,,,,6,7,8,,,,,,,,,,,,,,,,,,2,,,,,,,,,,,,,,,,,,,,,,,,,,,,,,,,,,,99,,,,,,,,,,,,,,,,,,,,,,,,,,,,,,,,,,,,,,,,,,,,,,,,,,,,,,,9,,,,,,,,,,,,,,,,,,,,,,1,,,,,,,,,,,,,14,,,5,,1,,2,,6,5,,,,,,,,,,98,V5,,,,,8,,,,,,,,,,,11,,,14,15,,,,,,,,,,,,,,2,,3,2,1,2,52
125464252,1,2,4,32,1,1,1,10,Long-used battery and the screen display is responsive and fast reponse when touching it.,9,Long-used battery. And this model is durable smartphone.,,,,,,,,,,,,,,,,,,,,,,,,,Bloated  battery,7,,,,,,,,,,,,12,,,,,,,,,,,,,,,,,,,,6,7,,,,,,,,,,,,,20,,,,,,,,,,,,,,,,,,,99,,,,,,,,,,,,,,,,,,,,,,,,,,,,,,,,,,,,,,,,,,,,,,,,,,,,,,,,,,,,,,,,,,,,,,,,,,,,,,,,,,,,,,,,,,,,,,,,,,,,,,,,,,,,,,,,,,99,3,,1,,2,,6,3,,,,,,98,F5,,,,,,,,,9,,,,,,,,,,,,,,,,,,,,,,,,,,,,99,3,,3,2,3,2,76
125464470,1,2,4,31,1,2,1,9,Front and rear cameras take clear and sharp photos. Smooth and good flow as well as fast processing when using it. Long-used battery and fast charging speed.,10,Fast processing speed when using the  device. And fast charging and long-used battery. Front and rear cameras take clear  and sharp photos.,,,,,,,,,,,,,13,,,,,,,,,,,,,6,,,,,,,,,,,,12,,,,,,,,,,,,,,,1,,,,,6,7,,,,,,,14,15,,,,,20,21,,,,,,3,,,,,,,,,,,,,,,,,,,,,,,,,,,,,,,,,,,,,,,5,,,,,,,,,,,,,,,,,,,,,,,,,,,,,,,,,,,,,,,,,,,,,4,,,,,,,,,,,,,,,,,,,,,,,,,,,,,,,,,,,,,,,,14,,,3,,1,,2,,6,3,,,,,,99,,,,,,,,,,2,,,,,,,,,,,,,,,,,,,,,,,,,,,,99,3,,3,2,99,2,31
125464668,1,1,7,48,1,1,1,8,Fast and responsive touchscreen. And this device has a good and fast signal connection with AIS network.,8,Rear cover has a nice color and long-used battery.,,,,,,,,,,,,,,,,,,,,,,,,,It was damaged,4,,,,,,,,,,,,12,,,,,,,,,,,,,,,,,,,,,,,,,,,,14,15,,,,,,,,,,,,,,,,,,,,,,,,99,,,,,,,,,,,,,,,,,,,,,,,,,,,,,,,,,,,,,,,,,,,,,,,,,,,,,,,,,,,,,,,,,,,,,,,,,,,,,,,,,,,,,,,,,,,,,,,,,,,,,,,,,,,,,,,,14,,,7,,4,,1,3,6,2,,,,8,,,,,,,,,,,,5,,,,,,,,,,,,,,,,,,,,,,,,,,,,99,3,,4,99,99,2,19
